Wie lange ist das Produkt haltbar?;0
Ist die Flasche mit dabei?;1
Wie lange reicht diese Dose ungefähr?;0
Kann das jemand bestätigen?;1
Hallo zusammen, weiß jemand wie hoch der Meshfaktor bei diesen Kapseln ist?;0
Hallo, ist die Hose unten am Fuß eng geschnitten?;1
Hallo, ich wart seit letzter Woche auf die Hose, wo kann ich mich da melden?;0
Welche Maße haben die?;0
Ist die Flasche spülmaschinenfest?;1
Hält die Flasche auch Kohlensäure?;1
Kann man die Hülle waschen?;1
Warum dauert der Versand bis zu 6 Wochen?;0
Ist es normal, dass sich Wasser nach jedem Brühvorgamg in der Auffangschale sammelt?;1
Hallo, ist es üblich, dass die Ausgabe der Kaffeereste so nass sind?;1
"Lassen sich auch Milchgetränke (wie ""mein kaffee"" von nivona) programmieren?";1
Wie lange dauert die Ladung, wenn sie voll aufgeladen ist?;0
Ist die Powerbank durchladefähig?;1
Wie lade ich die Powerbank auf?;0
Ist es auch für Männer geeignet?;1
Wir das Haar wirklich länger und voller?;1
Wachsen die Haare durch die Tabletten schneller?;1
Was für Wirkungen habt ihr bemerkt?;0
Stinken die Kapseln bei euch auch so?;1
Kann man damit einen 3-Tage-Bart schneiden ohne ihn komplett weg zu rasieren?;1
Wie ist das mit dem Indikator gemeint?;0
Ist es möglich den nachzubestellen ?;1
Kann man jedes Headset damit verwenden, oder empfehlen sich bestimmte Headsets?;0
Ist es möglich, das Programm auf mehreren Rechnern laufen zu lassen?;1
Ist die Nagelfeile zu etwas zu gebrauchen?;1
Hat das Messer eine Pinzette oder einen Zahnstocher?;0
Ist bei der schwarzen Version auch eine Hülle dabei?;1
Heizt das Gerät den Raum mit angeschaltetem Lüfter schneller?;1
Wie lang ist denn das Netzkabel?;0
Ist das Gerät auch für Feuchträume geeignet?;1
Hat jemand für das Spiel schon eine Spielmatte gefunden?;1
Kann es auch passieren, dass gar kein Schnittpunkt entsteht?;1
Ist das Spiel geeignet um es mit auf Reisen zu nehmen?;1
Hat jemand jedoch konkrete Angaben zum Geräuschpegel?;0
Wie viel Strom verbraucht das Gerät?;0
Kann das Gerät seitlich schwenken?;1
Gibt es bei dieser Geldbörse ein seperates Fach zum herausnehmen?;1
Passen auch Kreditkarten mit Schutzhülle in die Kartenfächer?;1
Muss eine Niederdruckarmatur installiert werden?;1
Welche Abmessungen hat dieser Artikel?;0
Kann das Gerät auch von einem Laien angeschlossen werden?;1
Kann ich das Gerät auch ohne Fangkorb nutzen?;1
Ist die Lüfterwalze dabei?;1
Ist die Messerwalze im Lieferumfang enthalten?;1
Wie stark muß die Absicherung in Ampere sein?;0
Ist die Schutzhaube per Knopfdruck verstellbar?;1
Ist das Spielzeug aus Holz oder Plastik?;0
Ist es für einen Husky geeignet von der Größe her?;1
Können auch Katzen damit spielen?;1
Kann man nach dem Zusammenbauen diesen Turm auch zwecks Reinigung wieder auseinander bauen?;1
Ist das Erscheinungsdatum offiziell?;1
Wird man das Spiel auch als Downloadcode vorbestellen können?;1
Ist das ein neuer Teil?;1
Wie viel kw die Stunde?;0
Es sind im Lieferumfang ja ein paar kleine Schwämmchen, wohin kommen die denn?;0
Hallo, wie kann ich denn innerhalb der 30 Tage mein Geld zurückbekommen?;0
Für was sind den die Gummiringe und die Schwämchen?;0
Was ist der Unterschied zwischen den Modellen TH und YF?;0
Funktioniert die Geschwindigkeitsmeldung einwandfrei?;1
Kann man die Kamera wirklich noch in die Hosentasche stecken?;1
Sind die Bälle sehr hart?;1
Hallo, was für Härtegrad hat der Ball?;0
Gibt es den Ball auch in einer weicheren Qualität?;1
Gibt es überhaupt Aufsteckbürsten mit kleinerem Kopf für Oral B Pulsonic?;1
Ich möchte den Strauß am 14.08. liefern lassen, wie funktioniert das?;0
Hallo, kann man die auch in schwarz bestellen?;1
Kann man die Lichterkette auch gegen eine andere austauschen?;1
Wie groß ist eines der geometrischen Formen?;0
Warum steht hier Prime und dann werden doch Versandkosten berechnet?;0
Funktioniert der Adapter auch in Mexiko?;1
Geht dieser Stecker auch in der Dom Rep?;1
Ist der Stecker auch für Japan/ Tokio geeignet?;1
Ist das die Wasserwaage mit dem Griff?;1
Was könnte das Problem sein?;0
Haben die Mannschaften der dritten Liga in Deutschland die original Kader oder sind die Namen zufällig?;0
Warum ist der Liefertag erst am 30.09?;0
Ist das Spiel auch auf englisch?;1
Welche Töne gibt es genau?;0
Würde mir jemand die komplette deutsche Gebrauchsanleitung zukommen lassen?;1
Wie ändert man von englischer Zeitangabe in die deutsche Zeitangabe?;0
Wie ist die Soundqualität zum alten Echo?;0
Kann man das Amazon Service mit Alexa auch in anderen Ländern verwenden?;1
Gibt es bereits eine Reaktion seitens Amazon hinsichtlich der zahlreichen schlechten Bewertungen des Klangs?;1
Mit welchem Mittel bekomme ich die am besten raus?;0
Wie wird die obere Klappe gehalten?;0
Verfärbt sich die Tasche bei Regen?;1
Welche Gewürze in welcher Kombination mit dem passenden Tonic könnt ihr empfehlen?;0
Schwitzt deine Haut unter der Band?;1
Da es magnetisch ist, gibt es ein Problem, es in der Nähe von Handys zu haben?;1
Könnt ihr uns helfen?;1
Ist das Spiel auch für Farbenblinde geeignet?;1
Ist die Gebrauchsanweisung in Deutsch?;1
Ab wieviel Jahren ist das Spiel?;0
Welche Instrumente genau sind in diesem Programm enthalten?;0
Ist das Programm kompatibel mit Win 10?;1
Kann man die Musik die man macht auch speichern?;1
Wie kann ich einen verschlüsselten Sender entschlüsseln?;0
Funktioniert der Receiver auch bei Kabelbw?;1
Mit welchem Betriebssystem wird denn jetzt ausgeliefert?;0
