Hallo, welches Blinkrelais kann ich hierzu verwenden?;0
Sind die Stämme so stabil das Katzen richtig drauf toben können ohne das er wackelt?;1
Ist das Häuschen aus Holzplatten und mit Stoff überzogen oder ist der Stoff nur mit Stäbchen gespannt?;0
Ist da wirklich der Kippschutzband drin?;1
Wie soll man die richtigen Schrauben den einzelnen Teilen zuordnen?;0
Sind die Bezüge abnehmbar und waschbar?;1
Wenn die Maschine einen Sanftanlauf hat, funktioniert der dann noch mit diesem Schalter?;1
Ist der Schalter für eine 2400 Watt Oberfräse ausreichend?;1
Hallo hat der Schalter auch eine Motorbremse?;1
Wie macht man Expresso?;0
Sind im Lieferumfang keine Padhalter enthalten?;1
Wie wenig Kaffee kommt dann?;0
Ist das nur das Ladekabel oder hat es auch einen Stromanschluss?;0
Welche Farben haben Sie ?;0
"Wie viel ""A"" hat das Schnellladekabel?";0
Gibt es eine Möglichkeit, auch die Applikation/ das Motiv auszuwählen?;1
Hallo, wann wird die Einschlagdecke in Dunkelgrau/Grau wieder lieferbar sein?;0
Kann man den Arbeitsspeicher erweitern?;1
Wie bekommt man das Teil über die Stange?;0
Kann man den Neigungswinkel des Brausehalters stufenlos verstellen so dass er waagrecht steht?;1
Wie verstellt man denn die Neigung der Halterung?;0
Kann man diesen Stangengleiter links oder rechts verwenden ?;1
Wie wird denn bitte der Befestigungsmechanismus der Stange gelöst?;0
Drehen sich die Rotorflügel automatisch?;1
Wird nur das Band geliefert oder auch Tasche und Heft mit Übungen?;0
Wo finde ich denn die Stärkeskala?;0
Was passiert wenn die Batterien leer sind?;0
Ist der Tresor denn feuerfest?;1
Ist der Tresor feuerfest und wasserdicht?;1
Kann mir da jemand helfen?;1
Ist der Rucksack pink/schwarz?;1
In was für einer Schachtel steckt die Flasche?;0
Hat die Flasche ein neues Desgin?;1
Hallo, welchen Innendurchmesser hat die Halterung?;0
Wie lässt sich die montierte Kunststoffbuchse entfernen?;0
Gibt es auch einen Halter den man ankleben kann?;1
Wie können diese Spiegel montiert werden?;0
Passen die angebenen Halterung mit den Spiegeln zusammen?;1
Reichen die vorgeschlagenen Lenkerhalterung zum Anbringen zwischen Griff und Gabel?;1
Wie trägt man die Schoner?;0
Wie lange ist momentan die Lieferzeit?;0
Hallo, handelt es sich definitiv um Originalware?;1
Welche Größe ist das?;0
Welche Teile sind aus Plastik?;0
Ist innen alles aus Glas?;1
Kann man den Filter herausnehmen?;1
Wie lange hält der Akku bei höchster Lichtstufe?;0
Hallo kann mir einer sagen warum sich der Liefertermin verschoben hat?;0
Wann wird die Konsole wieder lieferbar sein?;0
Fehlt da was?;1
Wie groß ist der Halsdurchmesser?;0
Was ist der richtige Durchmesser des Trichters?;0
Hat dieser Staubwedel ausreichend dicke Fasern am oberen Ende, so dass man nicht mit der Spitze des Stabs an Decken oder Wänden herumkratzt?;1
Kann man den Wedel auch mit einem Staubsauger reinigen anstatt lauwarmes Wasser zu benutzen?;1
Würde der Staubwischer sich dafür eignen?;1
Gibt es einen Staubwedel für die Teleskopstange?;1
Ist dort die Innentasche mit den 2 kleinen Fächern vorhanden?;1
Ist die Tasche wirklich wasserdicht?;1
Passt ein S9+ in die Tasche?;1
Wie sind die Innenmaße genau?;0
Kann diese Flasche auch von Kindern bedient werden?;1
Verfärbt sich die Flasche z.B. durch Magnesium?;1
Wird es in deutscher Sprachausgabe erscheinen?;1
Welche Innenmaße hat die Box?;0
Ist die Mikrowelle ohne Grill auch als Unterbau geeignet?;1
Kann mir jemand sagen wie ich die Warmhalte- bzw. die Extrabräunungs-Funktion einstellen kann?;0
Ist eine Grillfunktion vorhanden?;1
Funktioniert die Fernbedienung mit Funk oder mit Infrarot?;0
Wieviel Speiecher (MB) benötigt dieses Produkt?;0
Klappt das auch unter Linux ?;1
Kann mir jemand was empfehlen?;0
Ist es das englische Englisch, oder das Amerikanische?;0
Welche Maße hat der Teppich?;0
Ab wann ist der Teppich denn wieder lieferbar?;0
Kann ich das auch im Sommer tragen?;1
Wo kann ich die Uhr dazu kaufen?;0
Werden nur die Stunden und Minuten angezeigt oder auch die Sekunden?;0
Wieso steht da nichts mehr von BMW drauf?;0
Ist dieses Motoröl für Dieselmotoren mit Baujahren vor 2010 mit Dieselpartikelfilter geeignet?;1
Gibt es mittlerweile Erfahrungen z.B. mit Digital Revolution?;1
Ist er auch mit iPhone und iPad kompatibel?;1
Welche kompatiblen Fremdpatronen nimmt der Drucker ohne Probleme an?;0
Womit tragt ihr diese Uhr?;0
Ist eine Batterie schon dabei?;1
Ist der Sekundenzeiger hörbar, bzw. tickt diese Uhr?;1
Gibt es diese Uhr auch in komplett rot bei Amazon?;1
Ist das Armband aus Stahl oder Leder?;0
Wieviel A hat dieser Stecker?;0
Ist die lockere Schraube, ein Ersatzteil oder ist das einfach lose?;0
Kann ich diesen Adapter in Dubai nutzen?;1
Kann ich auch ein Balkongeländer hiermit planen?;1
Wo kann man den die Böden aussuchen dazu finde ich leider gar nichts?;0
Passt der Regenschutz auch auf einen 70L Rucksack?;1
Kann man zur Not auch normale Batterien einsetzen?;1
Passt die Lampe auch über Helme?;1
Ist die Lampe für das Joggen empfehlenswert?;1
Ist eine Schutzschaltung an der Lampe für Akkus ohne Schutzschaltung?;1
Was für einen Sinn hat das blinkende Rotlicht?;0
Können alle Apps die ich im Googlestore erwerben kann auch auf diesem Tablet benutzt werden?;1
Kann ich Filme die ich auf dem Tabet habe auch auf einen Fernseher ansehen?;1
Wie ist die Fotoqualitaet?;0
Kann man mehrere Seiten/Blätter kopieren, wenn man sie oben in das Fach legt, oder immer nur ein Blatt hinein legen?;0
Passen hier die Patronen vom Vorgänger HP 8600 plus rein ?;1
Kann man den Kopfhoerer reparieren lassen?;1
Gibt es eine Software um mit den Kopfhörer Surround Sound zu hören?;1
Gibt es hier auch eine Version zu kaufen ohne Spiralkabel sondern mit glattem Kabel?;1
Was ist ihre Größe?;0
Wie füllst du die innere Kammer?;0
Wie bekommst du den inneren Eimer?;0
Wie wird der Eiskübel Eiswürfel machen?;0
