Sind die Spitzen der Schraubendreher magnetisch?;1
Passt die Halterung an die Lochwand von Küpper?;1
Wie ist die genaue Bestückung des Sets?;0
Sind die Klingen gelasert?;1
Ist beim Kauf eine Rechnung und Garantiekarte dabei?;1
Kann man den auch als Exzenterschleifer benutzen?;1
Ist das hier der neue bzw. aktuelle Multimaster?;1
Was nutzt ihr als Adapter, um einen Haushaltsstaubsauger anzuschließen?;0
Wie sind die Maße ohne Rollen?;0
Sind die Rollen gummiert, also kautschukartige Weichräder?;1
Entspricht die Farbe Bordeaux wie der Abbildung?;1
Hallo, kann man den Stöpsel nach bestellen?;1
Kann man den Ball auch im Wasser (z.b. beim aquafitness) benutzen?;1
Gibt es irgendwo auch eine ca 22cm-Version ohne Stöpsel?;1
Wann erhalte ich die Lieferung erneut?;0
Da die große Rolle mit 26 x 9 cm relativ kurz ist, kann man den Rücken ohne Abrutschen behandeln?;1
Gibt es bei dem Set eine Gewichtsbegrenzung?;1
Wie sind die Erfahrungen mit dem Material bzgl. Qualität (made in germany?)?;0
Ist der Deckel Phtalat und bpa frei?;1
Eignet sich der Thermobehälter auch für Babygläschen?;1
Was passiert damit in der Spülmaschine?;0
Wie lang sind die Bügel der Brille?;0
Wann ist die blau verspiegelte Brille wieder verstellbar?;0
Ist die Sonnenbrille Cat.3 geschützt?;1
Ist die Brille unisex?;1
Ist die Färbungs- bzw. Polarisierungsstärke der Gläser verlaufend oder überall gleichmäßig?;0
Muss das Gerät bei Betrieb aufrecht stehen?;1
Gibt es eine Aufrollvorrichtung für den Druckschlauch?;1
Wo wird das Reinigungsmittel eingefüllt?;0
Ist die SSD in Notebooks(2,5zoll) und in Tower-Gehäusen(3,5zoll) einbaubar?;1
Passt der Riegel in ein Asus g70s Notebook?;1
Kann ich diese im Prodator Helios 300 verwenden?;1
Warum soll man sie nicht als Desktop Platte benutzen?;0
Ist die Platte für 24/7 geeignet?;1
Ist hier ein Anschlusskabel dabei?;1
Welche Firmwareversion haben die Festplatten die ausgeliefert werden?;0
Ist die Auflage atmungsaktiv oder ist häufigeres Schwitzen angesagt?;0
Ist diese Matratzenauflage in China hergestellt?;1
Aus welchem Material besteht die Auflage?;0
Wäre die Menge aufhaltbar?;1
Ist dieses Produkt überhaupt zertifiziert?;1
Wieso gibt es auch Schutzhüllen für den Reisepass?;0
Welches unabhängige Institut hat geprüft und welcher TÜV hat diese Hüllen geprüft?;0
Aus welchem Material sind diese Schutzhüllen?;0
Wie lange hält die innere Alu-Schicht beim häufigen Entnehmen der Karte/n?;0
Hallo zusammen, kann damit ein Türöffner bedient werden, z.b. über die Fritzbox?;1
Ist das eine Funkklingel?;1
Kann das Gerät auch mit Echo Show verbunden werden?;1
Kann das Gerät auch mit zwei Smartphone betrieben werden?;1
Wie lange hattet ihr den Sitzverkleinerer drin?;0
Bekomme ich das bitte noch nachgeschickt?;1
Ist der Sitz genauso groß wie das ältere Modell?;1
Ist es wasserdicht?;1
Kann man die Grösse des Uhres Armband einstellen?;1
Geht die Farbe nach einer Zeit ab?;1
Wie kann man das Band enger machen?;0
Wer ist der Verkäufer dieser Uhr?;0
Was ist der Unterschied zwischen der weißen und der schwarzen Packung?;0
Was ist denn der Unterschied zwischen den Reinigern in der weißen Verpackung, zu denen in der schwarzen?;0
Läuft der Ventilator sofort weg, wenn er Strom bekommt und eine Stufe eingeschalten ist?;1
Wie lange ist die Garantie für dieses Gerät?;0
Kann man (wie zB im Auto) den Luftzug schräg nach oben oder unten richten?;0
Wie lang dauert der Versand bei Standardversand, wirklich die 3 Wochen?;1
Hallo, zeigt diese Uhr auch von alleine die Uhrzeit ( ist es eine richtige Uhr) oder ist es eine Spieluhr, an der man die Uhrzeit selbst einstellt?;0
Hallo, wie werden denn die roten Kästchen auf dem Brett verschoben?;0
Ist diese Tafel auf deutsch?;1
Ist das normal?;1
Kann man die roten Kästchen nachbestellen?;1
Ist der Druckkopf (Druckdüsen) fest eingebaut?;1
Bis zu welchem Papiergewicht kann der Drucker im Duplex arbeiten?;0
Hallo, hat der et-4550 auch Einzelblattpapier Zufuhr hinten?;1
Auto-Duplexdruck ist möglich, aber trifft dies auch für das Kopieren über ADF zu?;1
Wie sieht das gerät denn nun farblich aus?;0
Wann ist dieser Artikel wieder verfügbar?;0
Hallo, hat der Laptop eine qwertz oder qwerty tastatur?;0
Ist das Beamen über längere Strecken problemlos möglich( nur erde-mond/oder z.b. aucherde-mars)?;1
Funktioniert der Beamer an der Wand?;1
Hallo ist ein 12V Betrieb ( wohnmobil ) möglich ohne einen Wandler zu benutzen?;1
Wie lange dauert es, bis das Gerät abgekühlt ist?;0
Wie viele Wimpel sind an der 190cm Kette?;0
Kann man das Etui auch mit 1-2 Karten nutzen ohne daß die Karten rausfallen?;1
Wohin mit dem Kleingeld?;0
Ist das echtes Leder?;1
Hat die Jausenbox einen Trennsteg zu Unterteilung?;1
"Hallo, welche Schriftnummer aus den 10 angegebenen ist ""Laura's Box""?";0
Wieviele Zeichen sind maximal zur Beschriftung möglich?;0
Ist die Dose aus lebensmittelechtem Edelstahl?;1
Werden die verbrauchten Kalorien auch angezeigt?;1
Kann man damit Laufeinheiten auch aufnehmen?;1
Funktioniert das auch Indoor?;1
Gibts es eine Möglichkeit das Wlan-Passwort zurückzusetzen?;1
Ist Sitzen für das Kind bequem, gemütlich?;1
Kann/darf man den Sitz auch auf der Beifahrerseite verwenden?;1
Schwitzt man in den schwarzen Sitz mehr als in den blauen oder grauen?;1
Ist die Lizenz zeitlich befristet?;1
Auf wieviel Rechnern kann ich pdf10 pemium installieren?;0
Ist das Konvertieren von Tabellen in der pdf nach excel möglich?;1
Kann man die mit dem Programm bearbeiten?;1
Ist der Stripe wasserdicht oder abweisend?;0
Wie viel Watt pro Meter hat der Stripe?;0
Wie viel Watt pro Meter werden denn benötigt?;0
Wie breit ist der Streifen?;0
Sind das alles trockene Weine, oder ist auch etwas liebliches dabei?;0
Haben die Weinflaschen einen Korken oder Schraubverschluss?;0
Liegt die Rechnung bei?;1
Wird das Alter bei der Post kontrolliert?;1
Wenn ich einen Trockner auf eine Waschmaschine stelle, halten das die Dämpfer dann aus?;1
Wieviel Stück sind im Lieferumfang enthalten?;0
Passen diese Dämpfer für Miele Waschmaschinen bzw. Waschtrockner?;1
Wie hoch sind die Dämpfer?;0
Wenn ich einen Trockner auf eine Waschmaschine stelle, halten das die Dämpfer dann aus?;1
Kann ich beim Hersteller noch eine erwerben?;1
Gibt es Probleme mit dem Dichtungsring?;1
Gibt es Ersatztrinkflaschen anderer Hersteller die hier geeignet sind?;1
Gibt es auch ein vier-flügiges Edelstahlmesser zu kaufen anstatt zwei?;1
Wie lang ist das Kabel?;0
Wie lange halten die Batterien ?;0
Läuft das nur über Batterie oder kann ich auch Akkus verwenden?;0
Woraus besteht es, um Bruch während des Tretens zu verhindern?;0
Wie groß sind die Tore?;0
Was ist der Unterschied zum cm300?;0
Was ist der Unterschied zum cm900?;0
Kann mir jemand sagen wie gut oder schlecht das Gerät verschiedene Arten Stoff schneidet?;0
Ist MS Access im Produkt tatsächlich enthalten, auch wenn es nicht auf der Verpackung steht?;1
Wie lange ist der Aktivierungs Code gültig?;0
Hat sie 24 h Anzeige?;1
Wird die Uhrzeit dauerhaft angezeigt oder muss man immer erst auf einen Knopf drücken dafür?;0
Wo finde ich denn eine Bedienungsanleitung für die Uhr?;0
Wie stellt man das Datum ein?;0
Ist ein Ladekabel dabei?;1
Ist bei diesem IPad kein Stift dabei?;1
Kann ich davon ausgehehen dieser beim Kauf mit beiliegt?;1
Ist die Decke unten offen,d.h die Füße gucken raus?;1
Reicht die Decke denn dann für sie?;1
Kommt die Decke noch vor Weihnachten an, wenn ich sie heute bestelle?;1
Ist die Decke aus Baumwolle oder Polyester?;0
Kann man diese Stifte nachfüllen?;1
Haben die Stifte eine dünne oder dicke Mine?;0
Sind diese Stifte auch für matte Oberflächen geeignet, bzw. auch von matten Whiteboards gut abwischbar?;1
Kann man mit den Fototaps auch CD-Hüllen (papier) in einem Buch fixieren?;1
Halten die Bilder damit auch an der Wand?;1
Passen da auch die Polaroid Bilder rein?;1
Kann man mit den Klebern auch Polaroid Bilder kleben?;1
Kann man die Fotos, nachdem man sie mit den Tapes befestigt hat, auch wieder unbeschädigt entfernen?;1
Ist die Uhr wasserdicht?;1
Werden Fotos in Whatsapp Nachrichten auf der Uhr angezeigt?;1
Funktioniert die Fossil Explorist mit dem Huawei p9 lite?;1
Ist die Uhr wasserdicht?;1
Wie breit sind die Bänder?;0
Sind die Bänder gut für ein Bodyworkout?;1
Sind die Bänder nach Stärken gestaffelt?;1
Wie viel Belastung können die Bänder ertragen?;0
Bildet die Füllung nach einiger Zeit Klumpen?;1
Gibt es auch Füllmaterial nachzukaufen und wenn ja was kostet es?;0
Wie hart ist das Kissen?;0
Rosten die Verbinder nicht, wenn sie lange Zeit in der nassen Erde liegen?;1
Gibt es für die Reihentropfer selbst eine Verschlusskappe?;1
Ist das der Preis für einen Halter?;1
Sind Gardena Produkte für den Innenbereich geeignet?;1
Kann man die Rückwand weglassen, um die Bank so im Raum zu platzieren, dass sie von 2 Seiten aus zugänglich ist?;1
Hallo, ist die Oberfläche matt oder hochglanz?;0
Sind die Maße inklusive oder exklusive der Polster?;0
Was an dieser Bank ist aus echtem Holz und was Pressmaterial (außer der rückwand natürlich)?;0
Ist das Holz in Hochglanz?;1
