Worin liegt der Unterschied?;0
Gibt es nur die englische Sprachausgabe, oder wird die japanische ebenfalls vorhanden sein?;0
Hat das spiel deutschen Untertitel?;1
Wird man mit Monstern kämpfen wie auf dem Gameboy?;1
Gibt es für das Display eine Schutzfolie wie für Handys auch?;1
Laufen alle Funktionen auch mit einem iPhone?;1
Zeigt es nur die Geschwindigkeit an, oder auch wie viel das Fahrrad gefahren ist?;0
Ist die Hintergrund Beleuchtung dauerhaft?;1
Was mache ich falsch?;0
Startet der Computer automatisch oder muss man noch einen Knopf drücken wenn man los fährt?;0
Hi, kann es sein, dass die Batterie des Senders bei Auslieferung bereits leer ist?;1
Muss der Artikel geladen werden oder kommt er geladen?;0
Was braucht man um die Halterungen zu montieren?;0
Braucht man extra Rückstrahler oder sind die dabei?;0
"Hat dieses Armband auch den zusätzlichen ""Sicherungspin"" am Verschluss?";1
Wie viel Getränk kommt aus einer Tüte?;0
Welcher Inhaltsstoff bewirkt die enthaltene Kalorien?;0
Kann ich das auch für Soda Stream verwenden?;1
Hat die Tasche auch einen ganz langen Henkel?;1
Was ist der Unterschied zwischen der B6 und der Aloe7?;0
Gibt es für Vorbesteller einen Bonus?;1
Hallo, ist in der Standard Version auch eine Karte vorhanden?;1
Ist diese Tachenlampe wirklich wasserdicht?;1
Kann man das Pedal und einen Kopfhörer gleichzeitig anschließen?;1
Kann man die Anschlagdynamik auch deaktivieren?;1
Hat es eine Leuchtfunktion wie auf dem Video?;1
Sind die Erdanker auch zur Zelt Befestigung geeignet?;1
Ist der intensive Abrieb und das schnelle rosten normal?;1
Sind die kleinen Trageriemen abnehmbar?;1
Hat die Tasche Innentaschen oder sonst irgendwelche Einteilungen?;1
Passt ein Ordner in die Tasche?;1
Kann der Akku getauscht werden?;1
Wann sollte man den Filter wechseln?;0
Kann der Akku ausgetauscht werden?;1
Muss man den wirklich nach jedem Saugen ausleeren und reinigen?;1
Muss die Papierzufuhr beim Drucken ausgeklappt sein?;1
Ist bei diesem Laserdrucker schon ein halber befüllter Toner dabei?;1
Ist das möglich?;1
Wie verbindet man den Drucker mit dem WLAN?;0
Ist es möglich das Aktivierungswort zu ändern?;1
Kann man Stimme über integrierten Lautsprecher und Musik über line-out abspielen?;1
Leistet die Grafikkarte full HD, wenn man einen externen Monitor anschließt?;1
Kann man das irgendwie reparieren?;1
Kann man die deutsche qwertz Tastatur gegen eine schweizer qwertz austauschen lassen vor dem Kauf?;1
Wieviel Videospeicher hat diese Geforce mx150?;0
Ist die Flasche aus Borosilikat Glas?;1
Passen dort wirklich 500ml rein?;1
Welche Hülle passt da dazu?;0
Bekommt der Holzdeckel schnell Risse (dies ist mir mit einer ähnlichen Flasche nach dreifacher Benutzung passiert)?;1
Ist das Produkt ein Kaltreiniger?;1
Wie geht ihr beim Reinigen der Kette vor?;0
Hallo, kann ich auch Saugnapf-Darts benutzen?;1
Ist die Nerf groß?;1
Warum 1 bis 2 Monate für Versand?;0
Kann man hinten eine Armstütze reinmachen?;1
Hi, kann mir jemand sagen, welche Ballfarbe nicht nach Weichmacher riecht?;0
Ist der Capo für ein gerades oder gewölbtes Griffbrett?;0
Ist der kapo auch für eine Konzertgitarre geeignet?;1
Hält der Kapo auch an der Gitarre oben, wenn man ihn gerade nicht braucht?;1
Kann man diese Steckdose auch von außerhalb des Hauses erreichen?;1
Kann man ein Firmware-Update machen und wenn ja wie?;0
Wie hoch ist der geringste Verbrauch, den man hiermit messen kann?;0
Wie funktioniert das mit dem Abo?;0
Kann man ein Monatsschrift auch an eine Packstation liefern lassen?;1
Welche größe muss ich für mein Bett 140x200 bestellen?;0
Ist dieses Bettlaken auch für ein 2 mal 2 Meter Boxspringbett geeignet?;1
Wenn ich 2 bestelle brauche ich nur 1 mal Versand zahlen?;1
Wie weit muss man den abzuisolierenden Draht einführen?;0
Kann die Zange auch Hausstromkabel entmanteln?;1
Kann das Produkt auch der PH Wert von Luft messen?;1
Wie ist der Shelter bei Regen?;0
Ist das Crossoverzelt wasserdicht?;1
Kann man die Plane auch einzeln bestellen?;1
Wie ist die Gesamtlänge des Armbands?;0
Ist es aus Echtleder?;1
Passt es auch für eine Nokia Steel?;1
Hallo, ist der Lüfter für ein Gartenhäuschen geeignet?;1
Schaltet bei erreichter Temperatur auch das Gebläse ab?;1
Ist der Heißlüfter energiesparend?;1
Lockt man mit dieser Falle zusätzliche Motten von draußen an?;1
Kann man das Spiel auch in englischer Sprache spielen oder ist es nur deutsch?;0
Wird der Geruchsstop durch eine Wassersäule (sperwasserhöhe) oder durch einen Geruchstab sichergestellt?;0
Welche Distanz sollte die Duschrinne zur Wand (nach hinten und zu den Seiten) haben?;0
Wird ein steckbares Siphon mitgeliefert?;1
Kann man die Brille durch ein Reinigungsdesinfektionsgerät jagen?;1
Wie breit ist die Brille?;0
Ist die Brille für Brillenträger geeignet?;1
Verzerrt die Brille das Sichtfeld oder hat sie Stärke?;0
Schaltet es ab bei Wärme?;1
Muss ich diese beim Laden jedesmal entfernen?;1
Hört die Ladestation auf zu laden wenn der Akku voll ist?;1
Ist ein Ladekabel dabei?;1
Wie kann man das vorzeitige Verstopfen der Saugöffnung verhindern?;0
Wo bekommt man Ersatzbürsten?;0
Fährt er noch wenn sich ne Katze drauf setzt und mitfahren möchte?;1
Was ist mit Kabeln?;0
Hallo, ist es eigentlich normal, dass bei manueller Fokussierung das Objektiv ein deutliches summendes Geräusch von sich gibt?;1
Bewegt sich das Gewinde mit dem Fokus mit?;1
Gibt es diese auch für die Größe 80x200?;1
Passt das Leintuch bei einer Matraze mit 25cm Steghöhe?;1
Wie finde ich heraus, welche Farbe welche ist?;0
Kann mir jemand die Maße vom Klingelknopf geben?;0
Gibt es bei den vielen Klingeltönen auch sowas wie ein Alarmsignal?;1
Die 10er Version soll erst in 1-2 Monaten versandfertig sein, ist das richtig?;1
Hallo, ist die Matte auf Boden mit Fußbodenheizung nutzbar?;1
Ist die Matte absolut Laminatrutschfest?;1
