Mit Knebel oder ohne?;0
"Ich habe Hunger 
- bist du schwanger?";1
Und was haben nun der Eine und der Andere mit mir zu tun?;0
Kann jemand damit was anfangen?;1
"Was heißt hier ""übertreiben""?";0
Und da gibts keine Untertitel?;1
Hast du deine Box schon bekommen?;1
Was macht man denn da jetzt?;0
Warum können nicht alle so rational und klar denken wie du?;0
Wie wiegt man sich in der Schwerelosigkeit?;0
Führt ihr eigentlich ein Tagebuch oder so etwas ähnliches?;1
Die Luftwaffe hat tatsächlich einsatzfähiges Gerät für sowas?;1
Warte mal du wurdest mal ernst genommen?;1
Welcher Film aus 2015 soll den Publikumspreis gewinnen?;0
Haben sie Wahnvorstellungen?;1
Wird die Aufnahme später noch einmal online verfügbar sein?;1
Ja oder nein?;1
Wissen eure Muttis oder der Ex davon?;1
Wohnen Sie in Deutschland oder im Urlaub?;0
Liebt ihr den Herbst auch so wie ich?;1
Freunde, würdet ihr einer Freundin und mir helfen, so viele Retweets wie möglich zu bekommen?;1
Waren das die, die ein paar Sachen in den Wald tragen wollten?;1
Könnte sein, dass dies schon als Erfolg gilt?;1
Wann lässt du deine Schlafstörungen behandeln?;0
Okay, was wird aus diesem?;0
Können Sie Deutsch sprechen?;1
Was ist ein Gentleman?;0
Wann findet das Gratiskonzert statt?;0
Warum gibt es nur so furchtbar dumme Menschen?;0
Sind sie inzwischen wieder frei?;1
Ist da was dran?;1
Wo ist die Logik dabei?;0
Wer hat das alles finanziert?;0
In welches Land plant ihr zu fliehen wenn in Europa wieder Faschismus ist?;0
Du hörst die dir wirklich an?;1
Sie wagen es, sich über andere zu erheben, weil Ihnen der Pullover nicht passt?;1
Was ist wenn man nicht nah am Wasser sondern nah an Felsen gebaut ist?;0
Sind die Bilder von euch liebes Team?;1
Schon gehört?;1
Herzschwäche hatten wir gestern, was wirds diesmal?;0
Ist der dann so gruselig?;1
Und was hast du Samstagabend gemacht?;0
Wie viele Punkte gibt's fürs Erscheinen bei der Prüfung?;0
Warum ist meiner so tonnig?;0
Warum beleidigst du jetzt?;0
Tja, wozu noch zahlen, wenn die Niederlage bevorsteht?;0
Was habe ich nicht gemerkt?;0
Ach, jetzt ist das Video doch echt?;1
Stand von dem hier auch etwas in dem Artikel?;1
Wisst ihr schon, was ihr mir zu Weihnachten schenkt?;1
Wie heißt du denn?;0
Wie fängt man so ein Gespräch überhaupt an?;0
Woran scheitert das denn, an der Zahl der Follower oder denen, den man folgt?;0
Was ist dran lächerlich?;0
Wo kann ich die beantragen?;0
Ein bisschen sehr defensiv oder?;1
Die Gedanken sind frei?;1
Was hat das zu bedeuten?;0
Pflegeprodukte kosten bei uns nur ein Drittel?;1
Warum schweigen Sie nicht mehr?;0
Was kommt als nächstes?;0
Was ist eine SPD?;0
Was ist das Hauptproblem der Bildungspolitik?;0
Falls nicht was machst du?;0
Hast Du was getrunken?;1
Ist da noch Tomatenzeit?;1
Wie oft noch?;0
Warum waren die PanamaPapers so schnell wieder aus den Medien verschwunden?;0
Hermione heißt im Deutschen echt Hermine?;1
Was ist eigentlich dieses Redaktionsnetzwerk?;0
Wonach sortierst du?;0
Ist das Ticket noch da?;1
Habt Ihr den Film über Marokko geschaut?;1
Bekommt er wohl nochmal mehr Einsätze?;1
Du bist ja bestimmt mindestens Jurist oder Arzt oder beides?;1
Heute war Montag?;1
Wie viel kann man sich im Supermarkt erlauben?;0
Wie wärs, ein verlängertes Wochenende am Kotti?;0
Wie viel Angst muss eine Regierung haben, wenn sie Kinder festnehmen lässt?;0
Machst du unsittliche Dinge?;1
Wie lange brauchen faule Eier?;0
Wer macht die Tür nach dem Busfahrer zu?;0
Ob sich der Staat durchsetzen kann?;1
Warum bin ich so?;0
Wann war das?;0
Kann man sich den Anzug erspielen?;1
Habe ich irgendwas nicht mitbekommen, und das Urheberrecht steht kurz vor seiner Abschaffung?;1
Sind Sie eigentlich schon konvertiert?;1
Wie kannst Du jemanden nicht mögen, wenn Du diese Person nicht mal kennst?;0
Würdest du lieber reich oder berühmt sein?;0
Wer kann mir helfen?;0
Wann müssen berufstätige Eltern denn zur Arbeit?;0
Stehst du auf Käsefondue?;1
In der Netflix Version ist der Soundtrack anders?;1
Wann ist es aus der Mode gekommen, nett zu sein?;0
Kann diese Partei mal irgendetwas zu einer guten Zeit und pünktlich machen?;1
Was soll man da sagen?;0
Ich hoffe das geht klar?;1
Wollt ihr das?;1
Ist das nicht Geldverschwendung?;1
Sind die jetzt plastische Chirurgen?;1
Und was hab ich verpasst?;0
Wieso raffen die Menschen das nicht?;0
Wem glaube ich eher?;0
Warst du auf der Tour?;1
Warum sollte man Angst haben von Linken als Rechter bezeichnet zu werden?;0
Was ist wenn man alles davon gerne mag?;0
Wie ist das eigentlich, wenn man so ist?;0
Sag mal geht's eigentlich noch?;1
Muss ich's machen?;1
Den Tweet hat aber deine Mama für dich geschrieben, oder?;1
Kennst du ihn?;1
Welcher ist dein persönliches Highlight?;0
Von wem werden wir unterwandert?;0
Hat die Bremer Außenstelle bewusst Gesetze missachtet?;1
Wie hat er euch gefallen?;0
Und das soll mir helfen?;1
Und wann habt ihr vor, das auf der Website zu ändern?;0
Haben sie Belege oder Beweise?;1
Woher kenne ich das bloß?;0
Gilt das Rauchverbot an Tankstellen nur für Kunden?;1
Auf wen tippst du?;0
Hast du schon mein neues Video gesehen?;1
Wo bin ich?;0
Wie war deine Woche bisher?;0
Was habe ich verpasst?;0
Wieso denn nicht?;0
Du hast Geburtstag?;1
Bekommt man dafür Geld?;1
Wie stellst du dir das vor?;0
Willst du es nochmal erklären?;1
Hat jemand von euch schon selbst Blöcke für Gutenberg programmiert, den neuen Wordpress-Editor?;1
Sag mal brauchst du Hilfe?;1
Was haben bloß alle gegen mich?;0
Wenn wir unsere Körperteile gegen Technik austauschen, sind wir dann noch Menschen?;1
Auf mich oder ihn bezogen?;0
Was macht ihr gerade so?;0
Wieso reden Russen immer mit sich selbst?;0
Was machst du lieber?;0
Hast Du PayPal?;1
Was für Geräusche machen Regenwürmer?;0
Warum dauert das so lange?;0
Warum ist schwul eine Beleidigung?;0
Wo soll dies noch alles enden?;0
Ist das nicht schön?;1
Du gehst auf mehrere Konzerte?;1
Und welche Tatort-Folge?;0
Warum kämpfen die denn nicht für ihr Land?;0
Der hat eine eigene Pressesprecherin?;1
Wo gibt es sowas?;0
Was mache ich nur?;0
Wollen Sie ihm das nicht lieber wegnehmen?;1
Gibt es dazu eine Quelle?;1
Hat das denn stattgefunden?;1
Wie willst du buffen?;0
Was ist das?;0
Was ist in ihrem Koffer?;0
Was musste denn bewiesen werden?;0
Habt ihr das auch schon gesehen?;1
Das Geschrei nennst du Kunst?;1
Habt ihr heute schon gelacht?;1
Woran erinnert uns das bloß?;0
Was kann schon passieren?;0
Woher kenn ich das nur?;0
Wen meinen Sie denn konkret?;0
Was ist passiert?;0
Wisst ihr was hässlich ist?;1
Wofür seid Ihr?;0
Haben Sie den vollen Durchblick?;1
Gibt es dafür nicht diese Powerplates?;1
Willst du nicht irgendwann ausziehen?;1
Und kann ich das jetzt auch mit Pfeffer würzen?;1
Jetzt übertreiben wir, oder nicht?;1
Lässt sich wirklich jemand von dem Kasperletheater ablenken?;1
Seit wann folgst du ihr?;0
Warum ziehen Sie zu diesen Thema eine deutsche Statistik vom ADAC heran?;0
Wie krank ist das denn?;0
Guckt der sich seine eigenen Berichte überhaupt an?;1
Den kennt ihr ja, oder?;1
Was wunderts dich?;0
Kann eine Zeitung ein Denkmal sein?;1
Wem glaube ich eher?;0
Was tun Sie dann noch hier?;0
Deine durchschnittliche Schlafdauer ?;0
Gehts immer noch um die, von der du mir gestern erzählt hast?;1
Warum erfindet jemand Make-up, um Sommersprossen abzudecken?;0
Wo hast du die gekauft?;0
Hast du vielleicht noch einen Code?;1
Kann man Sie auch nicht ernst nehmen?;1
Holt Dresden jetzt Paco aus Aue zurück?;1
Was kommt durch meine Augen?;0
Was ist denn das Problem?;0
Wäre es dann eine Utopia oder eine Distopia?;0
Sie wissen schon dass Sie Kriminellen zu ihrem Geld verhelfen?;1
Wie wird das entschieden bei Schachmeisterschaften?;0
Ist das ein Ferrari Enzo Bike?;1
Wann planen Sie die Anreise?;0
Wieso schläfst du auch den ganzen Nachmittag?;0
Warum macht er sich die Mühe?;0
Wo zum Geier kommt das immer her?;0
Oder hast du andere Alternativen?;0
Hey Jesus, darf ich sonntags tanken?;1
Ist die Kündigung also politisch motiviert?;1
Du hast deinen Reisepass aus den Augen verloren?;1
Aber hat er nicht irgendwie Recht?;1
Schon mal erlebt, dass ein Apple-Benutzer sich abfällig über Androiden äußert?;1
Seit wann haben wir nen Twitter Account für das Academy Team?;0
Beamten waren keine dabei?;1
Wegen eines Herzversagens?;1
Hast du dir deine Zuckermaschine neben deine Badewanne gestellt?;1
Eine entspannte Serie, die nebenbei laufen kann?;0
Schon jemanden gefunden?;1
Merkst du dass du ihre Werbung machst?;1
Bist auch noch nüchtern?;1
Distanzieren Sie sich?;1
Isst du mehr am Morgen oder am Abend (durchschnittlich)?;0
Was ist denn in Schlesien?;0
Wie kann man um etwas Angst haben, was einem gar nicht zusteht?;0
Wollen wir vier Frauen im Regierungsrat?;1
Ist das denn schlimm?;1
Soll das ein Witz sein?;1
Warum baust du es so oft um?;0
Hast du was gefunden und Zeitraffer Aufnahmen erstellt die irgendwann mal öffentlich zugänglich sind?;1
Wen hätte man dann aber vom Reden abhalten müssen?;0
Ist es überhaupt eine?;1
Wenn du ein Lehrer wärst, was würdest du unterrichten?;0
Erinnert ihr euch an 2015, als viele von uns die Live-Streams von der ungarischen Grenze schauten?;1
Na will wer welche haben?;0
Hast du es gesehen?;1
Hat er dich blockiert?;1
Warum sollen wir eigentlich den Deich instand halten?;0
Warum lassen sich Leute lieber erschießen als Verhaften?;0
Was müssen Lehrer bei Fotos von Schülern beachten?;0
Setzten Täter Fluchtwagen in Brand?;1
Aber wer will schon dichten können?;0
Wann kommt die denn?;0
Ist das Chemnitz-Video authentisch?;1
Wer war das?;0
