kann man bei diesem Drucker nur schwarz als Druckfarbe einstellen?damit die farbpatrone(toner)nicht benütz wird?evtl.,keine original Patronen?
Drucke extrem selten. Habe ich hier auch das Problem, dass die Tinte rasch eintrocknet? (Druckvolumen ca. 10 Ausdrucke im Monat)?
Darf der Drucker mit der Tintenpatrone ins Handgepäck im Flugzeug???
Kann der Drucker auch unterwegs ohne WLAN Verbindung von IPhone oder IPad aus betrieben werden?
Läuft der drucker auch auf dem macbook unter highsierra 10.13.06?
Was ist der untetschied zwischen dieser maschine und der hd7863/60.?
Wenn ich mir die rezensionen anschaue, 30 bewertungen und davon 26 (!!!!!!) vinetester, die sie für umsonst bekommenn haben. glaubwürdig? nee?
Nachdem man die Kaffeemaschine angemacht hat und eine Tasse drückt läuft es nach dem erhitzen automatisch oder muss man nochmal die Taste betätigen?
Ist genug Platz unter dem Auslass um auch die 400ml Coffee2Go Becher drunterzubringen (Höhe 13,5cm)?
Kann man die Wassermenge, so wie beim Vorgängermodell HD7863 umprogrammieren? (Beide Knöpfe für 1 und 2 Tassen drücken, Netzstecker rein u.s.w.)?
Ist ein Ladekabel dabei?
Ist die bearbeitung von office dokumenten gut möglch & ist das tranfer auf einen windows rechner ohne probleme machbar?
Ist bei diesem IPad kein Stift dabei?
"Welches ipad ? version 2018 oder 2017 ? welcher chip? a9 oder a10? etwas mehr produktdetails wären für den verkauf hilfreich;-)?"
auf der Produktansicht ist der Pencil mit zugelegt. Kann ich davon ausgehehen dieser beim  Kauf mit beiliegt?
Kann man mit dem Gerät Briefkuverts bedrucken?
Hat der drucker einen sd karten einschub um direkt von der sd karte zu drucken?
Ist Tinte dabei?
Kann man auch auf (overhead) Folie drucken ? über den Einzelblatteinzug ? wenn ja, wie ist die Qualität ?
Welche standfläche braucht der drucker? d.h. wie weit sind die füße auseinander? mein druckertisch ist 46 * 46 cm ...?
Ist die matte auch für burpees geeignet? möchte sie gern für mein hiit training nutzen?
Aus welchem Material besteht diese Yogamatte?
Ist die Yogamatte auch für Outdoor geeignet?
Ich habe vor einem monat eine yogamatte bestellt und warte immer noch darauf. können sie mir helfen?
Wie dick ist die Matte?
Ist das Armband nickelfrei?
Ist das armband auch mit der hr variante kompatibel?
Passt das Armband auch an die lintelek ID115 fitnessuhr?
Passt das armband champagner farblich zu der alta hr rosegold?
Ist das angebotene Armband S oder L???
Kann ich statt Wasser auch Kirschsaft nehmen? Oder würde dies die Funktion des Boosters einschränken?
sind die inhaltsstoffe rein pflanzlich? oder enthält das produkt teilweise auch inhaltsstoffe auf milchbasis?
Ist der Booster glutenfrei ?
Darf man es jeden Tag verwenden?
Versendet ihr auch nach Österreich?
Wie weit ist etwa die Reichweite der Bridge?
Die alte bridge lief auch mit osram lightify lampen, diese auch?
Funktionieren auch lampen / spots von anderen anbietern mit der neuen bridge ? empfehlungen?
Kann man den Leuchtring ausschalten?
Gibt es eine Halterung für die Bridge?
Geht die Nachttischlampe an wenn man sie absteckt und dann wieder ansteckt?
Kann das Glas abgenommen werden, um z.B. innen Staub zu wischen?
Leider flackert die lampe unkontrolliert. ich habe die verpackung aber bereits entsorgt. was kann ich tun?
Wo kann ich die lampe ein- und ausschalten? es ist gar nicht gekennzeichnet.?
Wird eine glühbirne/led mitgeliefert?
Kann ich an die Anlage ein Handy oder MP3 Player über ein AUX-Kabel abschließen?
Welche Schrauben muss man für die Lautsprecher verwenden? Und wieso werden die nicht mitgeliefert? Finde keine passenden Schrauben!?
Wieviel Watt verbraucht euer 906er im ausgeschaltetem Zustand? Bei mir 22W?
Kann man die Rear-Boxen auch auf Stativständer stellen, oder müssen die an der Wand mit entsprechender Halterung angebracht werden?
Muss man das Gerät manuell einschalten oder geht es automatisch an, wenn man die Stromzufuhr einschaltet? (über eine Steckdosenleiste)?
Ist weiß wie abgebildet oder mehr Elbenbein?
Ist laut dieser liste eu 43 = us 10..??
Fallen sie genau aus ? Also habe Größe 43 brauche ich dann 44?
Ich brauche die grösse 47 doch es gibt nur 47 1/3 würde die mir passen oder ist da ein groser unterschied ?
Welche eu größe brauche ich bei us 10? 43 oder 44?
läuft diese version unter windows vista?
Auf wie vielen pcs kann ich die software parallel installieren? brauche ich mehrere schlüssel?
Mein rechner hat windows 8 mit 64 bit version. ist das eine ausreichende systemvoraussetzung?
Kann ich mit einer iso dvd ganz normal installieren?
In der beschreibung ist von office 2016 die rede ...was ist es denn nun für eine version?
Gibt es die Schokolade auch einzelt zu kaufen?
Hallo, eine Frage ist dieser Wein trocken, halbtrocken oder lieblich?
Hallo, ich wollte 2 stuck kaufen, aber es gibt immer noch die versand preis. bitte teilen sie mir die info. mit.?
"Worin unterscheidet sich die ""frustfreie verpackung"" variante ct250mx500ssd1(z) zu der ohne das (z)? ist die ssd selbst identisch (in pappschachtel)?"
Wo ist der unterschied zwichen der Mx500 und der Mx300?
Sind für vor dem clonen besondere schritte oder einstellungen notwendig, oder kann man einfach mit acronis loslegen?
Eine frage von einem anfänger der technischen informatik: ist die ssd festplatte auch in einen laptop einbaubar? und muss ich hier auf etwas achten?
Liegt ein adapter zum einbau dabei und ein usb kabel?
Kann man auch 2 Schlösser mit den gleichen schlüsseln haben?
Wie dick ist der Bügel? Danke?
Ich habe das schloss für meinen keller bestellt. 2 mal aufgeschlossen und beim dritten besuch im keller ließ sich das schloss nicht mehr aufschließen?
kann man irgenwo einstellen, dass das display auf dem tracker ganze zeit die daten (zB Puls) anzeigt?
Funktioniert die Uhr auch ohne Bluetooth ?
Wie lange hält der Akku im normalen Gebrauch?
Könnte man die uhr auch am oberarm, grütel oder am knöchel tragen? habe viel mit wasser zutun.?
Hat die Uhr einen Countdown timer? Wenn ja, ist er lautlos?
Wird das Game einen deutschen Untertitel haben?
Ist das spiel Deutsch Untertitel oder sprache?
"Für wie viele Vorgänge reicht eine ""Spritze""? Kann man die Menge mit Hilfe der Spritze so dosieren, dass es der Menge entspricht die man nehmen sollte?"
Wo liegt der unterschied zwischen der mx-2 und der mx-4 ?
Hallo, wie viel macht man von der wärmeleitpaste auf die cpu und die gpu? eine dünne schicht oder schon etwas mehr?
Welche Wärmeleitpaste ist besser die mx 4 oder mx5?
Ist die paste auch für die ps4 effektiv oder muss ich da eine andere benutzen?
Kann jemand mir sagen, wie man diese Schnur-freien Kopfhörer auflädt?
Ich verstehe nicht so ganz wie die Lautstärke über die Kopfhöhrer geregelt werden kann?
Ist es mit dem i phone x kompatibel?
Kann man 2 geräte gleichzeitig verbinden (z.b. privat und geschäftshandy)?
Lässt sich der akkustand auf dem handy neben dem bluetooth symbol anzeigen ?
Kann mir jem. die länge der hose in cm durchgeben bei der größe S oder bei der größe M? wäre sehr nett,danke?
Bin 1,82 und habe 75 kg . muss ich größe l nehmen ?
Sind die hosen in S locker oder eng ?
Kann man die hosen kostenlos zurücksenden?
Wenn man sich diese hose als Frau bestellt , welche grösse? 1,78 60 kg?
Geht die tasche auch als umhängetasche (über die schulter von einer seite zur anderen) zu tragen?
Kann man die Tasche auch waschen, falls sie mal beim Abstellen schmutzig wird ?
Würde ein Laptop und eine 1,5 Liter Wasserflasche reinpassen?
Ist das rot wie auf den Bildern?
Würde ein Laptop sowie eine 1,5 Liter Flasche reinpassen?
Kann ich damit auch auf Amazon Prime Video zugreifen ?
Kann man eine festplatte an den usb anschließen? wenn ja, bis zu welcher größe und welche formatierung (fat 32, mtfs...)?
Kann man auch ard und zdf mediatheken schauen?
Kann der Player 4K Filme abspielen?
Hat das gerät cinch anschlüsse für audio um z.b. cds abzuspielen?
Woran erkennt man nun ob ich einen neuen controller bestellen kann? sehen für mich auf den bildern gleich aus wie die ps4-start-controller.?
ist ein ladekabel dabei?
Hallo! Ich wollte fragen, inwiefern sich der Controller von der älteren Version unterscheidet?
Hat jemand Erfahrung mit dem weißen Controller und kann mir sagen ob der schnell schmutzig wir und zum dreckigen weiß übergeht ?
Stimmt es, das Headsets von anderen Firmen als Sony nicht im vollen Umfang an der Klinkenbuchse funktionieren? Das Mikro soll nämlich nicht mehr gehen?
Hallo,mit Fahrspurassistent?
sind sämtliche verfügbaren karten installiert oder muß man sich eine  auswahl herunterladen die der speicherplatz zulässt?
Bei frage 2 wird als antwort gegeben: bitte verbinden sie das ladegerät am auto...wie ist das zu verstehen? bzw. welches ladegerät ist damit gemeint?
kann man auch koordinaten eingeben?
Wo platziert man das Navi am besten im Auto?
Ist diese Inspektionskamera wasserdicht?
kann ich die kamera über mein iphone nutzen? bilder und videos machen und auch speichern?
Leider kam die kamera ohne Bedienungsanleitung. Wie heißt die app für android?
Ist es für jedes Android Handymodell geeignet?
Hallo. Leider kam die kamera ohne Bedienungsanleitung. Habe keine ahnung wie die app für android heißt.?
Handelt es sich bei diesem Modell um das 2017 Release?
Kann man telefonieren?  Wenn ja wie?
Unterstützt es auch Wireless Charging?
Kann man es ohne Nano-Sim benutzen?
kann man eine mikro SD einbauen mit 128 GB, oder geht noch größer?
Hat diese Uhr auch eine Alarm-/Weckerfunktion?
Ich habe leider die batterie verloren. kann mir jemand sagen, welchen batterietyp diese uhr benötigt? danke!?
Welchen Umfang muss das Handgelenk mindestens haben?
Kann man das weiße Armband leicht reinigen? Oder ist es nach kurzer Tragezeit unansehnlich?
Wird die Silikonhülle mitgeliefert?
Passt das gehäuse auch für die gopro hero 5 black oder gibt es da unterschiede?
Passt alles auf die Hero 6 Black ? brauche vorallem das Wasserdichte case das muss bombe sitzen (fürs skydiven) und die hülle zum verstauen von allem?
Ist das wasserfeste Gehäuse geeignet um damit zu tauchen?
Beeinträchtigt die schutzfolie auf der linse die bild oder videoqualität?
Hallo,  wie hell leuchtet die taschenlampe? geht davon eine gefahr für die augen aus wenn das kleinkind hinein bkickt? was dient als leuchtmittel?led?
Which language do they have for songs and everything? Possible to have English if not already ?
Hallo, auf welche Lautstärke beginnt es wenn man die Taschenlampe einschaltet?
Wie kann man die Birne tauschen, wenn diese defekt ist?
Kann man auch nur das Licht aufdrehen ohne Musik?
maximale Belastung in kg ?
Wie viel Gewicht hält die Hängematte aus? Steht zwar für 2 Personen darauf aber was ist die Belastungsgrenze?
Kann man die Hängematte auf einen Rasen stellen der ein leichtes Gefälle hat?
Hallo, kann ich mich auf den Liefertermin (ab 12.06.2015) verlassen, wenn ich jetzt bestelle oder kann sich das Lieferdatum verschieben?
Hallo, kann man die Hängematte auch zur Abwechslung an einem Baum (2) anbringen?
ist die brille wirklich so biegsam wie auf dem bild?
Habe mir bei ihnen die brille gekauft alles ok jetzt ist ein glas kaputt bekomme ich die einzel?
Gibt es auch die Gläser einzeln zu kaufen ?
Hallo, wer kann mir sagen, ob wenn man durch die Brille schaut, man alles in blau sieht?
Ist diese Sonnenbrille auch kontrastverstärkend? So dass sie nicht einfach nur alles dunkel macht sondern quasi nur die Sonne ve?
Wechseln die Farben automatisch oder kann man auch eine Farbe einstellen ?
welche farbe ist es,pink oder weiss und wie gross ist es?
Bei mir sind die Batterien schon nach nicht mal 1 Woche leer. Ist das normal?
Geht sie von alleine aus?
Auf den bildern wird gezeigt, dass das gesamte einhorn leuchtet. in den rezesionen steht aber oft, es leuchtet nur der bauch.??
Passen die für den marella XL?
Ist dieser produkte ist, wo die produktion?danke!?
Passen die Kartuschen auch in den Fjord Cool?
Um wie viel reduziert die filterkartusche die wasserhärte? unser wasser ist zwischen 20 und 25° dh.?
Are this the original filters from Brita? Is there a date of expiration for the filters?
Ist die Füllung nochmal zusätzlich in einem Beutel oder direkt im Kissenbezug?
Raschelt das Kissen?
"Whay come just one pillow 80x80 cm, and dont come ""set of 2 40x80"" like in description of the name?!? I need 2 pillow 40x80?"
Ist das Kissen eher Weich oder eher Hart ?
Ist das Kissen abwaschbar?
Fallen bei der Bestellung Zollgebühren an?
Bei der variante türkis/hellgrün/transparent sind das dann 3 oder 4 farben (petrol noch zu sehen, auf dem bild)?
Mit wie vielen Bällen wird’s denn voll? Reichen da die 200 Bälle die dabei sind?
Sind die Bälle schadstofffrei?
Hat jemand mal den Pool gemessen?? Bei unserem fehlen 10 cm (durchmesser)?
Wie viele Folien sind enthalten?
Aus welchem material besteht der siebträger? handelt es sich um edelstahl? wie hoch kann eine tasse sein das sie noch unter den siebträger passt?
Is the portafilter pressurized or non-pressurized ?
Ich bin 176 groß und wiege 60 was passt da @.@?
Bin 1.51 m groß welche größe brauchecich?
Bei der jacke steht nicht dri-fit und fehlt ebenfalls das andere zeichen, obwohl es auf den bildern angezeigt wird. ist das normal ?
welche größe brauche ich bei 1,71m 57 kg?
Bin 1,78 und wiege 65kg welche Größe brauche ich?
Hallo, das Objektiv sollte mit der Canon 40  kompatibel sein. Es stellt weder manuell scharf noch mit Autofokus.An was kann es liegen ?  Danke?
Habe eine 550d , beim drehen des scharfstellringes verändert sich nichts, auch kann man den ring endlos in beide richtungen drehen, ist das normal?
Hallo! in einer beschreibung habe ich gelesen, dass das objektiv komplett aus plastik ist. gilt dies auch für das bajonett?
Woran merkt man, dass der bildstabilisator funktioniert? bei anderen objektiven hört man manchmal ein summen. danke!?
Hallo, hat jemand versucht sternenbilder zu machen?, evtl. Auch mit Guiding?. Ich möchte wissen ob die Bildqualität bei 10mm gut ist. Danke!?
Aus welchem Material besteht das Gehäuse, Plastik?
ist das display matt oder spiegelnd?
wieviele usb Anschlüsse hat das gerät?
Schönen guten morgen, ich benötige  das microsoft office (word,exel,powerpoint) und einen drucker, reicht dafür der speicherplatz aus?
Hat das iota slim 14 zoll einen schacht für eine m.2-ssd, welcher genutzt werden kann, um den speicherplatz zu erweitern?
Wie kann man das Datum einstellen?
Does the watch come with its own box?
Kann mir jemand sagen wie man das Datum umstellt?
Where can i get this armband too?
Wie kann mann die Uhr laden Bzw das die nicht stehen bleibt ?
Wie hoch ist der Wasserverbrauch pro Minute?
Kommt bei so einer Brause nun mehr Wasser raus, oder wird die gleiche Menge Wasser einfach auf mehr Düsen verteilt?
Hallo.hoffe mir kann einer helfen.ist bei dieser brause ein schlauch dabei?
Welches Material ist die prause?
"Wie ist die Verpackung? Eher billig ? Plastik oder im Karton? Würde die Brause gerne jetzt verschenken! Sollte nicht nach 1€-Shop-Ware aussehen ;o)?"
gibt es für den Becher auch ein Decken? Damit kein dreck und staub auf das Silikon kommen kann.?
Bis zu welchem alter kann man die Becher nutzen ?
Meiner läuft aus, ist aber zusammen gebaut nach Anleitung.?
Kann man auch milch darin zu trinken geben? wegen der reinigung meine ich. bin mir nicht mehr sicher was drauf stand.?
Ist das material unbedenklich? bpa-frei?
Wieso können Dash-Button nicht bewertet werden?
Hat es eine Batterie? (Bonusfrage: wie bestelle ich Batterieen nach, wenn die Batterie in meinem Batteriebestellknopf leer ist?)?
Kann man mit dem Ariel Dash Button jetzt nur Ariel bestellen oder auch Dash? Ist doch eine ganz andere Marke! :-) SCNR ... :-d?
Kann man auch beispielsweise den Persil-Button für Pampers einrichten? Und kann man das Produkt später ändern?
Wie oft muss man die Batterie des Geräts wechseln?
