Kann man die Trennwand auch einzeln nachkaufen, wir haben unsere verloren.....?
ich würde gerne die trennwand einzeln nachgkaufen da sie in kiga wegkommen ist...?
Wie groß ist die Box?
Passt die box vorne in die brotdosentasche vom scout schulranzen?
Die box ist wirklich süß. jedoch haben wir sie gerade ein paar mal verwendet und der verschluss ist abgebrochen. wo kann ich das reklamieren?
Ich trage gr. 40. (fußlänge bis 26,7 cm)  nach der hier abgebildeten tabelle müsste ich gr. 44  bestellen. fallen die schuhe wirklich so klein aus?
Sind die Schuhe auch für den Alltag geeignet?
Ich würde die schuhe fur die sauna nutzen, da ich nicht mit schlappen laufen kann. wären solche schuhe dazu geeignet ?
Sind die Sohlen rutschsicher?
Beträgt die lieferzeit tatsächlich 14 tage bis 3 wochen? brauche die schuhe nach dem we?
Hallo, ist das Set mit je zwei Teilen?
Hallo mein sohn ist 6 jahre alt und wiegt 28 kg und ist 1,30m groß. reicht da größe s?
Sind die schützer zum reinschlüpfen?mit extra klettverschluss oder nur klettverschluss?
hallo ich bin 9 jahre alt bin 1,40 groß welche größe passt mir?
Hallo, mein sohn wird 8 jahre wiegt 29 kilo und ist 1,34 groß. reicht größe s ?
Wieviel wiegt der Helm?
Wie macht man das Visier ab?
Wie ermittel ich die Größe, die ich brauche?
Kann die Beleuchtungseinheit auch rausgenommen werden ?
Wie kann ich das Visier abnehmen?
Bekomme ich noch das alte Flaschendesign?
Welchen alkoholgehalt hat der hier angebotene tanqueray 10? auf den abbildungen sieht man 47,3%, im text steht jedoch 41,4%.?
Warum ist Schwefeldioxid zugesetzt? Haltbar muss der doch sicherlich nicht gemacht werden ?
Hat die Flasche einen Schraubverschluss?
Warum ist Schwefeldioxid zugesetzt? Haltbar muss der doch sicherlich nicht gemacht werden ? oder doch ?
Ist dieses Kissen auch für seitenschläfer geeignet?
Hallo, wie lange hat ihr gebraucht um an den Kissen sich zu gewöhnen?
Woher weiß ich, welche Höhe für mich die Beste ist?
Hallo, kann man noch ersatz-bezug nachkaufen? einer meiner bezüge  ist mir kaputt gegangen.?
Kann man es testen?
Sind die Lampen jetzt Dimmbar oder nicht ? Oben steht ja unten steht nein?
Welchen maximalen durchmesser haben diese leuchtmittel? (da es 3 varianten gibt, bitte auch die entsprechende leistung 3, 3.5 oder 4.5 w) angeben)?
Werden diese lampen sehr warm?? Ich möchte sie in holz einbauen!!?
Möchte eine halopin g9 25w mit 260lm in einer dunstabzugshaube ersetzen. ist dieses produkt geeignet?
wie lange sind die Leuchtmittel?
Muss man auf einen knopf drücken oder die hand bewegen wenn man die uhrzeit oder sonstiges vom display ablesen möchte?
Hat die uhr einen Höhenmeter messer?
Kann die Uhr WhatsApp und fb etc anzeigen?
Erkennt die Uhr den Schlafrhythmus von alleine oder muss man die Schlafzeiten vorab eingeben?
kann man auch an der steckdose aufladen ?
Wenn man dieses spar abo nimmt kann man das auch ändern ? Zum beispiel wenn die kleinen eine grösere größe brauchen ? Lg?
Ist da auch Paraffin / Mineralöl drin? Soll ja bei den baby dry so sein und bei simply dry nicht.?
Wir haben premium protection pants gekauft, in der Verpackung sind allerdings premium protection active fit pants! Wurde hier falsch geliefert?
Senden sie auch nach polen? wieviel kostet den versand?
Wo sieht man dass die windel voll sind? Habe premium protection gr. 4 gekauft aber gelber streifn ist mitten auf der windel nicht. Wo sieht man dass?
Enthält das Set genau die abgebildeten Farben?
Kommt die Charge 2 Uhr zusammen?
Ist dieses Armband einfach an meinem Fitbit zu befestigen?
Wie weiß ich, ob die Größe der Band zu mir passt oder nicht?
Habe eine Fibit charge 2 large, kann ich da auch ein Armband small anbringen?
Kann man es auch mit dünner Hülle benutzen?
Kann die halterung durch den magnetismus nicht die elektronik oder das display beschädigen? danke vorab!!?
Gibt es keine Schwierigkeiten mit dem Handy und dem Magnetismus? Z.B. auch mit den Speicherkarten soll man ja nicht mit Magneten in Berührung kommen.?
Geht das für das iPhone SE?
Passt der halter auch für das sony xperia z5?
Mein sohn ist im november 2 1/2. ist das für nikolaus noch ein gutes geschenk oder schon zu baby-mäßig?
Für welches Alter ist das Spiel denn geeignet?
Kann man das Brett gut auf eine Flugreise mitnehmen oder purzeln die Kugeln immer schnell raus?
Hätte ein 4 Järiger auch noch Spaß daran?
Kann man es gut mitnehmen auf reisen oder ist es sehr groß und schwer?
Ist das Modell für den Strand geeignet?
Hallo, wie ist das maß der innenraumbreite der wanne? ich möchte einen käfig in dem wagen transportieren. vielen dank.?
Hallo, mit wieviel Gewicht kann die Verlängerung beladen werden?
Ab wann wird er denn wieder bestellbar sein?
Was ist der Unterschied zum CT-700?
Kann man die Lampe auch mit dem Kabel dauerhaft an den Strom anschließen?
ist die Kugel schwimmfähig?
Kann man die Lampe aufhängen?
Ist die Lampe hell genug, dass man sie als Leselampe benutzen kann?
Ist das Licht angenehm zum Einschlafen?
"kann mir bitte einer sagen,wie stark (wieviel mm) das Blech ist (möglichst an dünnter Stelle) u. ob die Becken ""gezogen""oder angeschweißt sind? Danke!?"
geht rogramm auf win 10 zu benutzen?
Möchte die maus nicht als gaming-mouse sonder als office-mouse nutzen. kann man auf die programmierbaren tasten die del-funktion (löschen) definieren?
Funktioniert diese maus auch mit mac os?
kann man die Innensohle herausnehmen?
ist der Schuh wasserdicht?
Kann ich prime-videos,-serien und -filme auf die sd-karte packen und dann problemlos offline ansehen?
Kann ich damit mit einem stift (für die uni) in pdf dateien schreiben ?
Wie kann man den google play store auf dem amazon tablet hd8 installieren? Bitte um Hilfe?
Hat das Gerät Bluetooth?
Gibt es eine Youtube app oder muss man über den Brwoser gucken?
Gibt es andere patronen für diesen drucker, denn die originalen haben schlechte bewertung. wenn ja welche sind es?
Hat der Drucker ein Fach für Papier (zB: Schublade unter dem Drucker) und wenn ja wie viel Papier passt in das Fach? Kann es von Vorne beladen werden?
Kann man mit dem HP5740 Briefumschläge bedrucken ?
"Was sind die unterschied zwischen ""mono-touchscreen"" und ""mono-touchscreen + duplex"" ?"
Kann ich mit dem Gerät mittels Einzug auch doppelseitig scannen? Und funktioniert scan to pdf?
wie lange gibt es denn Garantie?
Ich habe keine Rechnung bekommen,so kann ich nicht wegen die Garantie registrieren...was soll ich jetzt tun??
Kann ich auch stärkere Akkus in den Schrauber setzen?
Passen die akkus in das dab+ radio?
Kann ich anstatt den 2 ah akku, auch den 4 ah akku benutzten ?
Ist das bluetooth 4.1 oder höher ? und wenn diese kophörer eventuell vorgänger hatten ist dieser kophörer die neuste version ?
Wie ist reichweite der bluetooth-verbindung des noise cancelling kopfhoerer?
Wie sind die Innenmaße der Ohrmuschel?
Gibt es schon Erfahrungen bei Flugreisen?
Lässt sich anc auch ohne musik bzw bluetooth oder kabelverbindung dauerhaft nutzen?
Was hat es mit den 6000 Counts auf sich?
Was ist true rms,was bedeutet das?
Ist das Gerät kalibriert?
Welche Messkategorie hat das Gerät?
Auf dem 1. bild ist auf dem display ein usb und bluetooth symbol, steht aber nirgends dass es das kann...?
Ist der Saunakübel mit Kunststoffeinsatz?
Ist bei der karte ein adapter auf sd-karte im lieferumfang enthalten?
Ist die Karte kompatibel für das Navi Garmin nüvi 2699?
Kompatibel mit einem htc a9? bräuchte es als speichererweiterung?!?
kompatibel Samsung galaxay s 3 mini?
Wo findet man die Garantiebedingungen?
Evo Plus vs Pro Plus. Was ist der unterschied? Angeblich ist die viel teurere Pro Plus schneller. Laut Datenblatt sind Sie identisch (100 mb/s etc.)?
Hallo. kann mir jemand sagen, ob diese karte für eine yuneec drohne (foto & video) mit der 4 k technik geeignet ist? bessere karten evtl?
Hallo, hat jemand erfahrungen mit der 256gb-karte und einem microsoft surface pro 3? danke und viele grüße.?
Ist das uhs-i oder uhs-iii?
Reicht diese karte für die gear 360 (2017) oder muss es die pro plus sein?
Funktioniert der unisex-Tracker mit Samsung J 5 ?
Hallo, ich habe mit schwimmen angefangenn und suche jetzt eine Uhr die wasserdicht ist und mir anzeigt ob der Hort oder die Schule angerufen haben.?
"Gibt es daf&uuml;r auch Ersatzarmb&auml;nder?"
Kann man mit dem tracker auch die Strecke beim Radfahren messen?
Ich brauche die Teststreifen zur Cremeherstellung, sind diese dafür auch geeignet? Danke!?
Um den Ph-Wert einer Vagina auszumessen ist dies eher ungeeignet oder?
Kann ich mit den Tests auch eine Übersäuerrung im Körper fest stellen?
Wie lange taucht man das Papier in die Flüßigkeit und wie lange muss man warten bis man abliest?
Kann man damit auch den boden ph wert messen?
Passt der Sack mit Rasenschnitt gefüllt auf eine Schubkarre?
Ich benutze den sack, um heu und stroh auf dem garagendachboden zu lagern. sind die säcke luftdurchlässig?
Werden diese Säcke bei dem örtlichen Grünschnttabholen mitgenommen?
Passt der Sack gefüllt mit Rasen in eine Schubkarre?
"Ist das material wasserdicht oder eher ""atmungsaktiv""? denn ich möchte erde rein füllen und es bepflanzen. löcher will ich nicht reinschneiden?"
Lädt es gleich schnell wie mit dem originalen ladekabel (pixel 2 xl)?
Ist dies für die Switch geeignet? Sehe die stecker nicht von vorne :)?
Ist es passend für das Google Pixel 2 Handy ?
für welche Schuhgröße ist Größe M gedacht?
Geht dieser Stutzen über die Knie?
Meine Tochter hat Schuhgr. 34 bei 1,45m Sollte ich dann XS nehmen, bzw. passen dann noch Schienbeinschoner darunter? Vielen Dank für eine Antwort.?
Sind die Socken 'gekennzeichnet' mit r/l?!?
Wür welche Größe ist L gedacht?
Hallo  kann man das Kabel für Dieselauto verwenden?
Ist im Lieferumfang eine Tragetaschen enthalten?
Welche abmessungen hat die befüllte tasche vom 2 x 3,5 m starthilfekabel? nicht gemeint sind die starthilfekabel von 2 x 3 m oder 2 x 4,5 m.?
Hat das Kabel einen Überspanungsschutz?
Kann ich auch damit mein quad zu quad überbrücken?
Sind die Dosen qualitativ mit Lock'nLock vergleichbar?
Hallo sind die dosen bpa frei?
Passen in den großen Behälter Mehl und Zucker rein?
Sind die wirklich bpa frei? steht in keiner beschreibung des artikels sowie auf dem karton?
Hallo wo finde ich ihre e mail adresse ? ist das set bunt gemischt oder alles in einer farbe ? weil ich brauche aufkeinefall pink!?
Wie groß sind die Chips? Können sie verschluckt werden?
Sind Batterien dabei? Welche braucht der Dino?
warum geht der Preis immer höher, es kam etwas über 20,-€ hatte es mir abgespeichert und heute steht 140,-€ kann doch nicht sein?
Stimmen die produktabmessungen 27 x 123 x 26 cm? auf dem bild, neben das kind sieht es aber nicht nach 123 cm aus.?
Was sagt der dino bei einer banane? ich verstehe ihn nicht, bananen machen mich so stark auch für ??????? danke?
passt diese Schürze auch einem xxxl- Griller?
ist die schürze hitzeabweisend?
Gib es auch in anderen Farben?
Welche Größe?
Ich habe eine lizenz für 3 geräte möchte nun jedoch nur noch 1 lizenz, kann diese mit einem upgrade installieren?
Hat diese version ein datenlimit? welche version ist ohne datenlimit?
Meine lizens ist abgelaufen, reicht dafür ein upgrade aktivierungscode oder muss ich nun erneut eine vollversion kaufen?
Hallo, kann ich dieses produkt auch verwenden, wenn ich kaspersky bisher nicht auf dem laptop installiert habe? oder benötige ich dann ein anderes?
Ich habe kaspersky 2017 auf meinem xp rechner. kann ich das 2018 auch auf xp verwenden?
Hallo! hat das Gerät eine inverter regelung oder geht der Kompressor an/aus?
Kann das Gerät heizen? Wollte das Gerät in einem Holzhäusen aufstellen zum kühlen und im Winter heizen?
Wie lange sollte man nach dem Transport bis zur Inbetriebnahme warten?
Hallo, welchen Durchmesser hat der Abluftschlauch?
Hat das Teil eine Fernbedienung, bzw. kann die nachbestellt werden?
ist die oberebkette so wie auf dem bild an dem model oder so wie auf dem bild an dem schmuckständer?
Färbt die Kette ab wenn man sie länger trägt?
Kostet die ernsthaft nur 21 cent??
Ist in der Kette Nickel enthalten?
Kann man jeden chocker auch einzeln tragen?
Kann dieser Laptop Fortnight laufen?
Welche und wieviele usb anschlüsse hat das notebook?
Kann man den Line-out Anschluss auch als Line-in benutzen?
Wer macht in der Garantiezeit anfallende Reparaturen?
Geht bitte die wireless funktion? An die FritzBox?
Wenn man bei dem Rahmen mal klar und deutlich schreiben würde um welche Farbe es sich handelt, gäbe es nicht so viele Missverständnise!?
Welcher der 44 Verkäufer hat diesen Abdeckrahmen in Cremfarbe?
Passt dieser rahmen für den busch-jäger led dimmer 6523 u-102?
Passt der rahmen zu busch-jaeger 2115-214 zentralscheibe drehdimmer?
Ist der Artikel in alpinweiss?
Ist das fett für türscharniere am Auto geeignet?
Hallo !! Könnte ich es für die Spindeln der Wohnwagen stützen verwenden ??
Ist das fett auch für die lager und narben am mountainbike geeignet?
Leitet das Fett Strom, oder ist es ein Nichtleiter?
Wie ist die Konsistenz? Fest oder?
Wie groß sind die Tücher?
Sind die Tücher zum reinigen von Touchscreens geeignet? Fingerabdrücke entfernen usw?
Weiß jemand, ob eine Wäsche bei 60 °C auch gut geht? Hat das schon einer probiert? Aus hygienischen Gründen wäre mir das lieber!?
"warum soll man die tücher vor dem ""ersten mal anwenden"" kalt waschen?.so steht es auf der verpackung und wie männer nun mal sind, wissen sie es nicht?"
Sind diese auch gut für autofenster? meine jetzigen machen andauernd schlieren. oder vll mache ich was falsch. jemand einen tipp wie ich das streifenfrei hinbekomme?
geht der Stecker auch für Irland?
Hallo, ich reise demnächst in den süden afrikas (tansania, namibia, südafrika, zambia, botwana). ist der adapter dort auch nutzbar ?
Passt der Stecker auch in Simbabwe und Botswana?
handelt es sich um einen adapter mit (4,5mm stifte -19mm lochabstand) oder (5,1mm stifte- 26mm lochabstand)? es gibt in Italien 2 versionen?
Passt dieser Stecker auch für Indien?
Kann die uhr nicht verbinden, mit der veryfit pro app, es zeigt ständig an, daß kein gerät gefunden wurde. was tun um die uhr nutzen zu können?
Mein schrittzähler löscht immer wieder den aktuellen stand oder zählt erst gar keine schritte. woran kann das liegen?
Meine Uhr verbindet sich nicht mit der vorgegebenen App, habe die Veryfit pro installiert. Was tun? Danke für die Antworten?
hallo zusammen. wie sieht es aus mit nachrichten von whatsapp von einem ios (z.b. iphone 5)? (oft wird diese funktionen bei apple blockiert)?
Verfügt diese uhr über sekundenzähler und stoppuhrfunktion bzw. timer? ich benotige nämlich eine sportuhr für meine trainertätigkeit?
Wie lang ist der durchmesser?
Für frauen haben sie auch finde nicht in die Seite?
Nutzt jemand den Ständer für  ein eBike von Haibike mit ca.22 kg ?
Ist die maximalhöhe 140 oder 190 zm? die beschreibung ist nicht so klar.?
Hallo, der aufnahme kopf ist bei mir komplett eingerissen, gibt es diesen einzeln zum nachbestellen?
Mein Klapprad hat einen flachen Rahmen ca. 8cm hoch. Kann dieser auch eingespannt werden?
Ist das stativ auch für räder mit tiefem einstieg (hollandrad/gazelle) geeignet?
