Ist das Band selbst magnetisch, oder ist es neu ein Metallband an dem man andere Magnete befestigen kann?
Hält das Band auch auf verputzten Wänden?
Hallo, kann man dieses magnetband an einer wand befestigen und dann urlaubserinnerungsmagnete befestigen? also haltet das band etwas aus?
Hält das Band auch auf Holz/Spannplatten?
Wollte dasmagnetband in die schublade kleben für messer. ob dies wohl funktioniert?
Kann man ein handstück zusätzlich kaufen? Bspw.kaufe ich das komplette Set mit einem weißen handstück und möchte dazu noch ein schwarzes geht das?
Wie unterscheiden sich 9000-9000N-9000S voneinander?
Wo liegt der Unterschied zwischen der Genius 9000 und der 9000s?
Welche Funktionen kann ich nicht nutzen, wenn ich die App mal nicht benutze??
Kann man den timer auch auf 3 minuten umstellen?
Kann man die Herzfrequenzmessung separat ausschalten falls man diese nicht benötigt?
"Meldung ""forerunner 35 synchronisation fehlgeschlagen"" - keine datenübertragung möglich, reset, neuinstallation ohne erfolg, was kann ich tun?"
Warum kann ich die Uhr nicht mit dem Computer verbinden?
Wie kann ich nicht die aktuelle Pace anzeigen lassen, sondern auf einen Kilometer kumuliert? (habe hohe Schwankungen)?
Kann man die uhr verwenden, wenn man einen herzschrittmacher trägt?
Is the lte version has a region lock ? is there a sticker in the box said european sim only ??
Es gibt Speicherkarten mit einer einer geschwindigkeit bis zu 300 mb/sec. Kann das S3 die geschwindigkeit verarbeiten?
Kann ich auch zum telefonieren?
Ist rs wasserdicht??
Hello, we are interested in this tab whith keyboard cover for free but reading description seems the offer is between 23/03 and 16/04, is it true?. Ta?
Gibt Es dazu identisch passende Esslöffel?
Eignen sich diese Messer auch um Pizza etc. zu schneiden?
Welcher typ oder sorte ist das besteck? gibt es das besteck auch ohne holzkiste?
Hallo, wo genau muss ich die Texte für die Gravur hinterlegen und welche Schrifttypen gibt es?
Kann man das Besteck bei Ihnen gravieren lassen, wenn ja, zu welchem Preis?
Schwarze Unterlage fürs Daumen, ist das Gummi oder doch nur Plastik?
sind die tasten und das scrollrad leise oder mit klickgeräuch?
Für was sind die beiden linken Tasten, bzw. wie werden sie programmiert?
Passen 78, 66 und 55 zum aufbewahren ineinander?
Wie stelle ich meine geheime zahlenkombination des schlosses ein? ich habe hierzu keine information erhalten.?
Ist die Lieferung in 2 Wochen möglich?
Stimmen die Maße in der Artikelbeschreibung oder ist er ein klein wenig größer als 55 x35 x 20 cm?
Gibt es eine internationale Garantie für das Produkt? Bzw. wie bekomme ich diese?
Hallo, wie sieht es aus wenn etwas laub auf dem rasen liegt? gibt es damit probleme?
Für was ist in der App die Mähzeit in Prozent?
"Habe am dienstag mein ""landroid s"" erhalten alles wie in der anleitung vertratet .ist auch die erste runde bis zur station gelaufen...und jetz ?"
Kann der roboter über einen gepflasterten weg fahren? unsere rasenfläche ist durch einen solchen geteilt!?
Neuer!!! worx landroid wr110 mi.i beim versuch ihn mit der app koppeln ständig „fehler mäher bereits registriert“ kennt jemand das problem?
Wie darf ich mir die Montage vorstellen? Wie jede normale Deckenlampe anschließen? Funktioniert es dann nur bei eingeschalteten Licht?
Ständiges klick Geräusch weiß aber nicht wo das herkommt, jemand eine Idee? (seit ca 30std in Betrieb)?
ist die fernbedienung im kaufpreis enthalten oder kostet sie extra?
Ich besitze ab juni diesen ventilator.ich habe ein problem mit diesen ventilator. er schaltet das licht selbstständig ein oder auf die nächste stufe.?
Hello. I bought 4 last december. I had a home accident and the glass broke. Please I need to now how to buy the replacement. Thanks?
Kann ich diesen adapter auch mit den zwei pin us stromsteckern nutzen? Sollte doch gehen oder?
Kann ich mit diesem Adapter einen Blu-ray Player aus den USA mit 120V an eine deutsche Steckdose anschließen ohne dem Gerät zu schaden?
sind die beiden länglichen Öffnungen gleich lang oder ist eine größer?
Ist das auch für italien geeignet?
Hallo wir haben eine sega mega drive classic game console .anbei ist ein amerikanischer netzstecker, ist dieser adapter passend??
Funktionieren die creators-updates für windows 10, wenn man die festplatte (m.2) nutzt? (mit der samsung 950pro gibt es treiberprobleme)?
ist die ssd in notebooks(2,5zoll) und in tower-gehäusen(3,5zoll) einbaubar?
Past der riegel in ein asus g70s Notebook?
Kann ich diese im Prodator Helios 300 verwenden?
Wie schnell läuft windows mit 3000mb lese und 1600mb schreibgeschwindigkeit (hochfahren und so.) ?
Ist es für birma Katzen geeignet?
Ist die bürste auch für langhaardackel geeigent?
Ist die bürste auch für Jack Russel geeignet?
Nutzt man diesen kam um nach dem winter das winterfell zu entfernen, oder kann man diesen im winter auch nutzen um nur die losen haare zu entfernen?
Kann man Ersatz Kamm nachbestellen?
Hallo. hat schon jemand dieses etui für einen kessy schlüssel bestellt? welche größe braucht man dafür? vielen dank im voraus!?
iTunes Unterstützung? Kann mein iphone mit iTunes gut verbinden?
Funktioniert das kabel auch beim i-phone se?
Funktioniert das Kabel gut bei iPhone 6?
Kann ich mit dam originalen Apple Netzteil verwenden?
Was bedeutet es, dass dieses HDMI-Kabel ethernetfähig ist ? So ein Kabel verbindet doch normalerweise PC und Monitor ?
Funktioniert es mit hdmi 2.0b?
Welchen durchmesser hat der stecker? möchte wissen, wie groß ich ein loch bohren müsste. danke.?
Dem kabel lag ein warnhinweis bei, dass die geräte ausgeschaltet sein sollen, bevor das kabel eingesteckt wird. warum?
Was ist der Unterschied zum alten , 1 Euro günstigeren Kabel?
Hallo,  ich finde leider keine angabe zu lautstärke in DB?
wieviel kostet , und wann lieferbar ? ist Aigostar hansa 33 JTR?
Kann man das Display nachts ausschalten bzw geht es von selber aus?
Guten tag, könnte der verkäufer mir bitte angaben zum geräuschpegel machen? idealerweise in dezibel. vielen dank?
Weiß jemand wann man den Ventilator wieder kaufen kann? Aktuell scheint es ja keine Angebote zu geben...?
Hallo, wie dick ist das absperrband? also wie viele mikrometer hat es denn genau? ich bräuchte die technisch genauen werte. vielen dank!?
Hat das Band eher ein dunkles rot (so wie auf den Bildern) oder ein helleres (so wie auf dem Karton)?
"Ist der ""Abroller"", welcher auf den Bildern abgebildet ist, auch dabei?"
Wie lange ist die befestigungsschnur? wir haben 3,60m hohe decken. ist die schnurr dafür lang genug?
Kann man den Ring oben kleiner anbringen als geplant?
Wie ist der Durchmesser?
Wie groß ist der Durchmesser des Rings?
Ich möchte als eine leseecke eine erwachsenenmatratze nehmen. reicht der baldachin von der größe her aus, dass man ihn um die matratze drapieren kann?
Guten Tag, kann man von außen also nicht rein schauen, hingegen raus gucken schon? Lg?
Hält die Folie auch auf Plexiglas oder nur auf echtem Glas?
auf welche seite des fensters muss man die folie kleben?
Hello. We purchased your product on the 7th of august. We are still waiting. Can you please confirm an arrival time.?
kann man diese Folie auch auf einem Helmvisier anbringen???
Sind die Pipetten lebensmittelecht bzw. will sie für Whisky benutzen ist dies möglich ohne eigengeschmack?
Ich habe 3 ml Pipetten bestellt aber sie haben mir stattdessen wollfäden verschickt , würden sie mir die Pipetten noch mal verschicken ? :)?
Hallo sind bei 5 ml auch 0.5 Schritte oder ????
Kann ich diese pipetten auch für cbd öl verwenden, das ich einnehme? ca. 3-4 tropfen?
Kann mit dieser Pipette auch ein Ölgemisch aufgenommen werden?
Wann wird das gerät mit dem i7 prozessor und 16gb ram in deutschland verfügbar sein?
Wissen sie schon ab wann das matebook ungefähr geliefert werden kann? finde hierzu leider keine info.?
Wann wird der Artikel verfügbar sein?
Wann wird diese Version erscheinen? Danke im Voraus?
is there any approximate availability date?
Wenn man den gelbstich weg bekommt und man möchte aber das die haare etwas grau werden, gwht das auch mit diesem shampoo oder eher nicht??
Was sind die genauen Inhaltsstoffe?
Ich habe meine braunen haare balayage färben lassen. die deckhaare sind eher gold geworben. werden meine haare mit dem schampoo blonder?
Kann ich das Shampoo auch in der Schwangerschaft benutzen ?
Greift es dunkel gefärbtes Haar an? Hab Balayage..?
Aus welcher kunststoff-art (pe/pp/pet) besteht die kunststoffhülle?
Sind die Schläuche mit Sparadapter oder ist dort ein normaler Durchfluss?
Kann man 2 dichtungsscheiben nachbestellen?
Wieso kann ich den Schlauch nicht kostenfrei zurück senden?
Anschluss ( 1/2) für mich  zu groß. Was ist der nächst kleinere ?
Ist die baterie schon dabei ?
Normal das der minutenzeiger nicht richtig wandert und bei erschütterung spiel hat? Meine lief nach 3 stunden um ganze 20 minuten zurück?
Wiegt die Uhr wirklich 150 Gramm?
Tickt die Uhr laut?
Kann man die Uhrzeit trotz Dunkelheit lesen oder benötigt man ein Licht?
für wieviele qm ist das Gerät ausgelegt?
Wird der luftreiniger abkühlen? müssen sie wasser hinzufügen?
Wo erhalte ich ersatzfilter für diesen luftreiniger? bzw. gibt es evtl. standard filtergrößen, die in dieses gerät passen?
Auf wieviel Quadratmeter ist das gerät effektiv?
Kühlt er ähnlich wie ein ventilator?
Hallo,ist das die tactical smart watch v3 mit dem crystal corning gorilla glass 4 und dem wasserfeste gehäuse aus dlc?
Ist diese Uhr wasserdicht? Und viel?
fun sie auch mit whatsapp?
Hallo, können die nervigen tastentöne beim umschalten auf die verschiedenen modi ausgeschaltet erden, wenn ja, wie....bitte um hilfestellung.?
Hallo, hat diese uhr eine ce kennzeichnung? wenn nicht, gibt es ärger beim zoll und die uhr darf nicht eingeführt werden?
Past die Kette von Oregon 90PX052E auf das Schwert?
Habe ein paar Baumstämme (Thuja), welche ich nun in Bodennähe einkürzen möchte. Durchmesser ist ca. 25-30 cm. Kriege ich das mit der Makita hin?
- Ist der Artikel lange haltbar?
Laut Manual sind 90PX und 91PX Ketten geeignet. Können in dem mitgelieferten Schwert beide Arten verwendet werden (1,1 mm bzw. 1,3 mm Nutbreite)?
Kann man auf die Kettensäge auch ein 40 cm Schwert von Oregon montieren?
Wie sind die Maße?
Haben diese Stutzen unten einen Steg oder sind die frei?
Hallo.  Ist das rot so wie auf dem Bild eher Bordeaux oder richtig rot?
sehr geehrte damen und Herren,Ich benötige 50 Stück der Größe 1,  wie ist der Preis?
Also mein Sohn ist 2 und ist circa 90 cm groß nehme ich dann die Größe null?
Mein Sohn ist 115cm groß und welche Größe muss ich kaufen?
Ist das Endprodukt Lebensmittelecht?
Ist es möglich mit dem harz die maserung eines holzes hervorzuheben?ist das harz schleif-und polierbar?
Hallo, kann das epoxy auch auf styropor aufgetragen werden oder schmilzt dieses? möchte wasser im modellbau darstellen und die felsen sind aus styro?
Für wieviel m2 reicht das harz? es geht um einen anstrich im außenbereich einer outdoorküche?
Hallo, wieviele Anstriche sind bei OSB-platten notwendig?
Mein Kater pinkelt immer auf unsere Steinfliesen,entfernt man damit auch den Katzenurin ?
Wie sieht es mit feucht gewordenem Katzenstreu auf Fliesenboden aus?
Wie gut lassen sich Tierhaare aufnehmen bzw. wieder von dem Dampf/Wischtuch entfernen?
Löst er auch den Dreck in Fließenfugen am Boden?
Habe den dampfbesen von russell hobbs, der die böden sehr nass hinterlässt, sodass mittlerweile das laminat aufquillt. ist dies bei dem gerät auch so?
Riecht der Wasserkocher unangehm?
Lässt sich das Auslösegeräusch (Klick) der Kamera ausschalten?
Gibts es einen nachteil weil die kamera nur 12 mp hat?
Hat das gerät jetzt einen usb-c anschluß?
Ist das ein europäischess gerät?
wie schnell ist die SD Karte?
Kann ich den Mond dauerhaft mit Strom leuchten lassen oder muß ich ihn aufladen und dann nur mit Akku nutzen?
Sieht die lampe auch ausgeschaltet wie der mond aus? oder eher wie eine angeschmolzene plastikkugel?
Die klemmschienen werden ja an den fensterrahmen geschraubt. wird der fensterrahmen dabei beschädigt, oder wohin wird die schraube gedreht?
Wir benötigen ein Plissee in der Breite 46,5 cm für unser Treppenhaus-Fenster. Kann ich ein 50 cm-Plissee in der Breite kürzen?
Mein Fenster ist 1,70m breit. Kann ich zwei 0,85m breite Plissee´s nebeneinander hängen oder geht das technisch nicht?
Hallo, wenn die Scheibe 50cm breit ist, nimmt man dann genau 50cm oder etwas größer?
Kann man die (Klemm)träger auch an schrauben?
Würde es auch beim galaxy s9 plus gehen bzw passen?
Kann man es auch mit handy hülle benützten?
Außer dem Mobiltelefon kann ich die anderen Geräte installieren?
kann man die halterung schnell montieren?
Ist das Handy auch für Samsung  s5 geeignet?
Iphone 8 lädt mit dem kabel ohne schwierigkeiten, aber ipad scheint sich mit diesem ding etwa langsam aufladen. weiß jemand den grund?
Der einzige Unterschied das äußere Kabelmaterial?
Funktioniert das Ladekabel wie Original?
Gute ergänzung zum originalen ladekabel? wie fühlt sich das kabel im vergleich mit original?
Sind die kabel mfi zertifiziert?
Kann jemand bestätigen, dass das Gerät seine Einstellungen verliert, wenn man es vom Strom nimmt?
Sind handbücher und menüs auf englisch verfügbar? (sorry, mein deutsch ist schlecht!)?
Kann man einen Schallplattenspieler anschliessen ? Danke?
Hi, können auch bluetooth lautsprecher von anderen herstellern als denon mit dem gerät verbunden werden?
Ist es möglich musik vom denon receiver auf bose soundtouch zu hören, über wlan oder bluetooth?
Hallo! Wie lange habe ich Garantie auf das Gerät?
Hi, wie kraftvoll ist die säge da ich ziegel 24 cm breit schneiden muss mit natürlich richtigen sägeblatt ? ähnlich zu strom ? danke?
Welche schnittbreite und Tiefe?
Wie sieht der Transportkosten aus? Ist er im neuen oder alten Look?
Hallo, ist der Führungsschuh verstellbar? Ohne Werkzeug?
Ist der drucker mac os sierra 10.12.2 kompatibel?
Möchte diesen an meinen Samsung Laptop RF711 anschliessen. Habe VISTA Home Premium 64bit. Geht dies?
Muss man Originalpatronen verwenden, oder frisst der Drucker auch kompatible Patronen?
"Bedeutet ""duplex"", dass der drucker direkt beide seiten gleichzeitig bedrucken kann oder die Seiten automatisch selbst wendet oder weder noch?"
Welches Papier verwendet man am besten für den Drucker?
Wie bekomme ich den code?
Kann man diesen Code in Steam einlösen? Da man ja Steam auch mit dem PSN Konto verknüpfen kann. LG?
Ich hab mal ne doofe Frage :s Ich hab das bis jetzt noch nicht rausgefunden. Kriegt man den Code per Email zugeschickt oder wie?
Kommt der Code per email ?
code anzeige?
Ist das echtes Leder oder beschichtetes Spaltleder?
Das große Album entspricht also eher einem A4 blatt?
Sind die Seiten im Fotoalbum befästigt oder nur lose?
Ich finde keine möglichkeit, mit dem verkäufer in kontakt zu treten. wie geht das?
Wie kann ich den Händler kontaktieren? Habe da eine nicht unerhebliche Frage.?
Ist das öl verwendbar für winen opel astra g 16v 100ps?
Ist das öl für bmw 316i bj 2001?
Mein auto zafira b 2006 1. cdti mit dpf kann ich diesem oil benutzen ??
Ist die altöl rückgabe bei a.t.u kostenlos, für das bei amazon gekaufte motorenöl?
ist das öl verwendbar für opel astra (bj 2003 ) diesel / mit schlpsselnummer (0035) (379)?
kann ich dieses Gerät verwenden um zu gucken ob auf den Anschlüssen wo ich meine Deckenlampe anbringen will strom drauf ist ?
Hallo, kann man die sicherung bei diesem spannungsprüfer auch auch wechseln? also mit einem schraubverschluss?
Hallo, kann ich damit auch prüfen ob an eine TAE richtig verdrahtet ist?
