Ich werde 2 iphone, gps und auto cam zur gleichen zeit wird dieses auto ladegerät adapter arbeiten?
Was ist die maximale Leistung an einem 12 Volt Ausgang (nur ein Verbraucher)?
Hallo, das ladegerät funktioniert (golf v) nicht, keinerlei anzeige. woran liegt es ?? andere stecker funktionieren einwandfrei. dose ist also ok.?
Hat dieser 24v auto steckdose splitter einen usb anschluss für samsung galaxy note telefon?
Ziehen die usb anschlüsse durchgehend strom? und kommen die 2,4a auch an?
Hallo!  Wie viel wiegt ein Paar in Größe 45 exakt?
Nach der auswahl der größe 45 2/3 wird bei der bestellbestätigung 45 1/3 angezeigt - ist dementsprechend 45 2/3 nicht mehr auf lager?
Ist die innensohle, wie bei den meisten salomon-schuhen, herausnehmbar? im web findet man verschiedene aussagen.?
Kann man den Schuh in der Waschmaschine waschen?
Nur im Bezug auf Hochzeit oder auch anders nutzbar? (Geburtstagsgeschenk)?
Ist das abgebildete Motiv bereits auf dem Ledereinband vorhanden, oder muss es nachträglich eingestanzt werden?
Bis zu wieviel Blätter können nachträglich eingesetzt werden? Und wo kann ich zusätzliche Blätter bekommen?
Wie viele Seiten passen maximal in das Fotoalbum?
"Hi wieviel blätter passen den in das buch? ""nur"" die 30 oder kann man noch mehr blätter in dem buch dazufügen?"
Wie laut ist diese Gerät?
Hallo, ist auch platz für eine normale tasse, also ca. 200 ml. fassungsvermögen, bzw. ein glas für latte macchiato?
"Ist bei dem Modell ""weiß mit Aerocchino"" wirklich ein Milchaufschäumer dabei oder nicht?"
Sind Kaffeemehlreste in der Tasse ?
kann man auch günstige Kapseln aus dem Supermarkt verwenden?
Hallo. meine powerbank verfügt über einen 20v/5a output. kann ich trotz der 5a das zenbook laden?
Was ist alles in der Verpackung?
Kann man den laptop mit einer handy powerbank (z.b. anker powercore) laden?
Besitzt das Gerät eine integrierte Kamera?
Ist ein stylus im produkt enthalten? alle youtube reviews sagen ein stylus liegt mit im paket, aber hier steht davon nichts auf der seite.?
wie dick ist denn der Block?
Wie groß sind die Würfel - wie lang ist die Kantenlänge eines Würfels?
Wie groß ist denn jetzt der block? dina5, dina6? wie sind die maße von becher und würfel? danke für eine antwort.?
Warum ist der Becher zu klein?
Enthält das produkt eine keycard mit dem aktivierungs code oder wird er per post zugestellt?
Wieviel gb darf die micro sd karte haben . gibt es eine begrenzung es systems?
Kann das Gerät über USB geladen werden? Z.b. üner den Zigarettenanzünder im Auto.?
Wie geräuschintensiv ist das schreiben auf der neuen alcantaratastatur? würde ich in einem stillen raum(zb hörsaal) damit böse blicke auf mich ziehen?
Kann die docking Station vom pro 2 verwendet werden?
Gibt es beim neuen surface pro probleme mit dem magnetladekabel. Wackler oder ähnliches?
Kann ich diesen Gasschlauch mit meinem Weber Q1200 betreiben?
Hallo, passt der Gasschlauch auch für den Weber Q 1000?
Was für ein Anschluss ist grillseitig an dem Schlauch?
Hallo, eine frage muss man den regulierventil vom webergrill 1200q ausbauen und an den schlauch wechsel ?
Ist dieser artikel identisch zu diesem https://www.amazon.de/dp/b00yo8y6ta/ref=cm_sw_r_other_apa_pgxkzb1hscqvf ?
Wird zubehör mitgeliefert wie z.b. gegenlichtblende und uv-filter?
Wo ist der Unterschied zum samba og?
welche weite hat der Schuh?
Sorry für die vielleicht etwas blöde frage, aber kann ich den schuh auch im alltag tragen? es gibt hier anscheinend zwei versionen?
hat mann in den schuhen festen halt ich suche sportschuhe fürs Fitnessstudio mit guten festen halt ?
Ich hab das problem, dass die schuhe an der schuhzunge bei jedem schritt quitschen. geht das weg?
Ist das Trikot original?? Und ist es von der Saison 2016/17??
Handelt es sich hierbei wirklich um ein orginales Bayern Trikot? Der Preis von 45 euro lässt mich zweifeln...?
Kann mir den Preis nicht erklären? Wo ist der Halen?
Ist es hose und shirt?
Ich habe das abgebildete Trikot bestellt und eins erhalten ohne Polokragen und in Rot-dunkelrot...?? Keinerlei Verkäuferkontakt möglich?
Kann man das Glas mit hülle benutzen?
86 Kundenrezenssionen und wenn man darauf klickt ist keine da? Wie gibt es das??
Funktioniert die frontkamera noch nachdem die folie angebracht wurde? großes manko bei fast allen folien dass die cam nicht mehr brauchbar ist danach?
Das ist definitiv plastik und kein glas!! außerdem lässt sich das handy kaum mehr bedienen ohne blasen an den fingern. was hab ich falsch gemacht?
Was ist in der Box?
Läuft auf diesem gerät windows 10 home, premium oder 10 s?
Gibt es eine möglichkeit, den halter auch mit schrauben zu befestigen? da ich ein heißluftfön (600°) ablegen möchte, darf es nie(!) runterfallen?
Wie viel Gewicht hält die Halterung aus?
hat jemand erfahrung damit den halter nicht an fliesen sondern an einer wand zu befestigen? bzw ist das möglich und hält es?
wie viel kg kann die Halterung tragen?
Mit aufsatz (diffuser) hat mein fön 10 cm. passt er in diesen fönhalter?
Hallo, wie breit sind die Streifen und die Abstände dazwischen.? Danke.?
Erhalten Blumen hinter der Folie noch ausreichend Sonne?
Verlaufen die Streifen in Längsrichtung (200 cm) oder in Querrichtung (45 cm)?
Ist es eine statische Foliie bzw leicht wieder abzunehmen?
Muss man etwas beachten wenn man die Folie im Winter anbringt?
Kan man das zu einer Solaranlage anschliessen das man sieht wie viel Strom man bekommt?
Haben die zähler einen nachweis über die eichung, unser verein fordert das bei installation in der laube?
Warum ist der zähler nicht auf null?
Kann mir bitte jemand sagen wie das Teil angeschlossen wird! Es soll in einer Halle für unser Wohnmobil als Stromzähler verwendet werden.?
Kann man den Stromzähler wenn er eine Zeit lang lief, von Hand wieder auf 0 setzen ?
Ist Lautstärke verstellbar?
Wie ist die Reichweite?
Funkklingel a506, wenn ich 2 sets bestelle ,kann ich dann mit einem sender alle 4 empfänger zum klingeln bringen ?
Bei mir gehen die Lichter nie aus! Ich kann so lange halten wie ich will. Was soll ich denn noch machen?
Kann man 2 Sets miteinander koppeln?
In welchem set sind die 4 produkte (peeling, schaum, creme, spray) aus der beschreibung enthalten?
Wieviel ml haben die Flaschen?
Hallo, kann mir jemand die einzelnen Größen der Produkte sagen?
Ist der Kaffee heiß oder hat er schon Trinktemeperatur?
Bekommt man da auch richtige tassen oder gläser drunter also latte gläser oder so 13 bis 14 cm?
Hi kann man auch die Pads vom aldi, lidl und co benutzen ?
Hallo, schaltet sich diese maschine automatisch ab. denn in der beschreibung steht: automatische abschaltung: nein.....??
Es gibt senseo espresso pads - gelingt die zubereitung eines espressos mit dieser maschine?
"Hallo zusammen,
hat jemand schon einmal Fischstäbchen o.ä. in dem Airfryer gemacht? Sind diese dann auch richtig durch erhitzt?"
Was ist den der Unterschied zum Backofen mit Umluft ? Nur die Größe oder noch mehr ?
wieviele Brötchen kann man aufbacken?
Ist das normal, dass das Gerät während des Betriebs total laut ist und klappert? Teste es gerade leer.?
hallo an alle- ist das normal, dass das Gerät so stark raucht? Nach dem Benutzen muss ich alle eine Stunde durchlüften.... Danke für alle Antworten.?
Kennt man einen Unterschied zwischen Box & Flasche?
Hat der wein ein korken oder drehverschluss?
Wieviel % Alkohol hat der Wein?
Muss das gerät beim drucken waagrecht auf dem tisch liegen oder geht das auch hochkant bspw. in einer sakko-tasche mit papierausgang nach oben?
Kann man nur mit app drucken? app für windows phone gibts nicht.?
ist es möglich Bilder zu drucken während der Akku geladen wird?
Wann kommt denn die 2 in 1 Variante in den Handel?
Hallo. ist das via bluetooth mit iphone 7 bzw ios11 komptibel?
Muss das Teil jedes mal jedes einschalten oder wenn man den Wagen wieder verlässt ausschalten?
Wann sieht man das es sich voll aufgeladen hat ?
Wird das Gerät über den AUX mit Strom versorgt? Oder muss man zusätzlich ein Kabel an den Zigarettenanzünder legen?
Kann man das Gerät via Aux verwenden und gleichzeitig über USB laden? Ich plane das Gerät an einem Heimkino zu verwenden?
Schnellladekabel verwendbar?
Hallo, wie ist denn die erfahrung mit der leistung?  also wie groß darf die fläche des raumes pro tuch sein?
Können die Ersatztücher auch für den Robomop Softbase verwendet werden?
passt  dieser Virobi Ersatztücher auch  dem Typ Vileda 1361335_?
Warum versandfertig in 3 bis 5 Wochen???
Hallo, bleiben auch Krümel an dem Vlies haften?
Kann ich damit auch meinen Atomreaktor wieder anschmeißen wenn das Uran alle ist?
"Der ixo4 hat ja keinen ""softanlauf"", dh er gibt gleich 100% vollgas oder gar kein gas! ist das beim 5 auch so? ist für mich ein no-go!?"
Braucht man den Drehmomentaufsatz unbedingt? Für was ist der eigentlich notwendig?
kann man den Akkuschrauber benutzen während er aufgeladen wird?
Hallo! Wofür brauche ich diesen bohraufsatz? der standard ixo-aufsatz hat doch bereits eine sechskant aufnahme für bohrer, oder? Danke!?
Kann man ein Namenschild anbringen ?
Kann man die Batterie im Sender austauschen, oder ist sie fix verlötet?
Kann ich mit einen avantek-empfänger das signal einer novete-türsender-einheit empfangen ?
Wo bekomme ich einen zweiten Sender?
2. Sender möglich?
Hallo, geht die braune tasche etwas ins rötliche? sieht bei mir so aus. vielen dank vorab!?
Farbe der Verschlüsse? (Material)?
Ist der Schulterriemen lang genug, um die Tasche cross over zu tragen?
Wie ist die tasche innen?  Hat sie innen noch 2 zipper?
passt in die Handtasche eine 0,5 Liter Flasche??
Das Produkt kommt als CD oder ?
Wann kommt das Spiel raus?
Ist in der collectors edition auch der download der dayone-edition enthalten?
Bekommt man wenn man sich die collectors edition kauft ist die day one edition beinhaltend?
Gibt es Tiere(Pferde,Hühner...)?
Ist die tasse spülmaschinen fest?
Kommt es noch vor Weihnachten an wenn ich es jetzt bestelle?
Ist diese Tasse spülmaschinenfest oder zumindest geeignet?
dauert der versand wirklich so lange?
Wie lange  dauert die Lieferung?
Was passt hinein? eine 1,5 l volvic wasserfläche hat 30,3 cm höhe.  und die passt wirklich nicht in die kühlbox?
"Hallo zusammen,
ich bräuchte die Maße INNEN der box z.b: höhe x breite x tiefe.    Danke?"
Wenn man die Box zum Wärmen benutzen will, ist ein genauer Temperaturregler dran bzw. wie genau ist dieser?
Der Lüfter gibt ein leichtes knattern von sich, wie der berühmte “Butterdosendeckel“ in den Fahrradspeichen, halt nur in leise, ist das normal?
Wie sind die äusseren abmessungen lxbxh? vielen dank.?
"Warum wurde der titel zu ""downloadcode"" geändert? werden keine cartridges produziert?"
kam man zu 2 silen?
Kann man dieses Spiel auch mit dem 3Ds spielen?
Kann man das Spiel online spielen?
Brauch ich einen weiteren Controller für Multiplayer Lokal?
Welche Kapazität hat sie in mAh?
Welche kapazität - in mah angegeben - besitzen amazonbasics a312/1,45v?
Welche Kapazität haben diese 312 Baterieen?
Auf meiner alten packung steht 170mah und pr41. was hat das zu bedeuten?
Wieviele Tage funktionieren die Batterien bei täglichem Einsatz?
Wäre die tasche auch zur aufbewahrung von wechselwäsche für die kita geeignet?
An diesem Mini Washbag ist der Aufhänger defekt, er löst sich auf.?
Warum brennt dem Eichhörnchen eigentlich der Schwanz?
Würde diese kulturtasche in den mini rucksack mit bodenfach gehen - als kleine windeltasche mit tücher und creme?
Elektrische zahnbürste?
Kann mir jmd sagen, welche verbrauchsleistung das gerät hat? nicht kälteleistung, sondern stromverbrauch.?
Hallo, wie hoch ist der Geräuschpegel?
Wie laut ist das Gerät?
Kann bei Kühlfunktion auf den Abluftschlauch verzichtet werden?
Wie lang ist der Abluftschlauch der dem Gerät beiliegt?
ist das Kissen für einen Allergiker geeignet ?
Ist das Obermaterial Polyester oder Baumwolle?
Kommt das Kissen mit Inhalt? oder nur Kissenbezug?
Ist das nur ein Bezug oder ist das Kissen dabei??
Ist die uhr  wasserdicht, kann sie unter wasser den puls aufzeichnen.?
Kann man musik über die Ihr steuern?
Von der Uhr gibt es unterschiedliche Größen, M-L S-M und S? Für wieviel cm Handgelenk-Umfang sind die jeweils? Ich habe knapp über 15cm,welche nehmen?
Kann mir bitte wer die abmessungen von der polar m430 schicken? finde diese nirgends!?
Kann ich mit der m430 noch meinen h7 brustgurt verwenden oder muß ich zwingend den h10 kaufen?
Welche Große empfehlen sie für 8-9-järigen Junge?
Welche Größe ist für einen 3,5 Jahre alten Jungen zu empfehlen?3,4 oder 5? Kenn mich da null aus,danke?
"The titel says: ""10 pack derbystar junior pro light football recreational ball"". does this mean you send 10 balls?"
Kann man die Schuhe auch als normalen Straßenschuh tragen?
Hat jemand die Größe 37 bestellt und könnte mir das innenmass nennen?
Hat jemand die Größe 37 bestellt und könnte mir das innenmass nennen?
Hat jemand die Größe 37 bestellt und könnte mir das innenmass nennen?
Endet der Schuh oberhalb oder unterhalb vom Knöchel?
Wie groß ist die Verpackung?
An amazon: warum werden diese artikel trotz 3maliger reklamationen/beschädigungen laufend in der absolut inakzeptablen c1 verpackung verschickt???
Ich möchte den artikel gerne als geschenk in das nicht-europäische ausland verschicken. daher, wie sind die genauen abmessungen der verpackung?
Hallo, wie groß ist es in zusammengebautem Zustand?
Wann sollte man auf das erwachsene Futter umsteigen???
Bekommt man wenn man als geschmack mix angibt nur baby pate?!?
Handelt es sich hier um paste oder um soße mit fleischstücken? oder ist das bei den sorten unterschiedlich?
Wenn mann einen Mix bestellt, hat man dann 32 mal gemixtes Nassfutter oder nur Baby pate?
Moin hätte da Frage wieviel Fleischanteil ist enthalten.?
Ist die Flasche spülmaschinenfest?
Wie kann es sein, dass die Flasche bereits nach einem Monat völlig undicht ist? Nicht einmal in der Spülmaschine gewesen und die läuft trotzdem aus!?
Gibt es diese Dichtungsstopfen im Deckel nachzukaufen?
Hält die flasche heißen getränken wie zum bespiel tee stand? (muss keinen thermoeffekt haben)?
Haben schon etliche super sparrow flaschen und würden gerne nur neue sportverschlüsse haben. wäre das möglich?
Aus welcher kunststoff-art (pe/pp/pet) besteht die kunststoffhülle?
Sind die Schläuche mit Sparadapter oder ist dort ein normaler Durchfluss?
Kann man 2 dichtungsscheiben nachbestellen?
Wieso kann ich den Schlauch nicht kostenfrei zurück senden?
Anschluss ( 1/2) für mich  zu groß. Was ist der nächst kleinere ?
Kann man diesen Schuhschrank um eine Regal verkürzen? Reicht ansonsten wegen der Schräge der Wand nicht.?
geht der Schuhschrank auch als Hängeregal für die Tür zu verwenden?
Kann man auch schuhkartongs nebeneinander reihen?
Hallo, mein freund hat schuhgröße 47. eignet sich das schuhregal auch für diese größe?
Passen auch große Schuhe problemlos in den Schrank (Gr 47)?
